predator,senderID,letterLines,wordLines,numberOfLines,spaces,funkyWords,posEmoticons,neuEmoticons,negEmoticons,consecutiveLetters,alert,blacklist,misspelledWords,negativeSent,positiveSent,message
np,91f3eccf9f50a7880a98a2ac38d13385,0,0,2,0,0,0,0,0,0,0,0,0,-1,1,"your god is a lie no bill"
np,5efdc8a07a2d58175d4cb734069221e0,0,0,3,0,3,0,0,0,0,0,0,1,-2,3,"that link you posted seems to have an answer to your question hahaha how on earth does someone answer their own question by accident"
np,b4fb06241afce6183239a809b40f0998,0,0,2,0,2,0,0,0,0,0,0,0,0,0,"Hey there You first"
np,afa1cfe2046b664d42825ef60c80a617,0,1,24,1,11,6,1,2,3,0,4,2,-4,5,"h m mam u y XD XD u like anal mmmm can i eat ur ass out force me h can i see a pic how big are ur tits mmmm h got milk for me how old are u oooo man i wanna see a pic its fine pease cant wait"
np,eaa23271a7bd91ec051e41816da20507,0,0,3,0,0,0,0,0,0,0,0,1,-1,0,"hey bro no make me"
np,64cfcc6f37a049132c42aecc0cea220d,0,0,2,0,1,0,0,0,0,0,0,1,-4,0,"hi all got a strange problem with printers they disappear after a while any idea where to start looking for clues using delian samba"
np,9195ddae0b0d38a9c2fd1e0381edbd48,0,0,6,0,2,0,0,0,0,0,1,6,-1,0,"you shouldnt add it in there SX uses lookup which takes its confix from netinfo so you should add it into the configuration pane in the GUI System Preferences no it doesnt"
np,c7973aff9b7bdb0a0ad08d5b3d1ee712,0,0,4,0,14,0,0,0,0,0,0,7,0,1,"first of all if Issi needs it and you want Issi then you need both makes sense eh pkg_info grep ok then you have glib yet np glib is lib BTW gnetopsida use that"
p,47243a4a2c68f2f00899670d455a21fa,0,0,6,0,0,0,0,0,0,0,0,0,0,0,"A truck Ford Grey Grey Green Black"
np,77194253ee065122d06a4a8fecbc35bd,0,0,1,0,3,0,0,0,0,0,1,0,0,0,"hm my names are never more than two words anyway"
np,b25b6b77a0087ff8385941e5545d32ea,0,0,1,0,1,0,0,1,0,0,0,1,0,0,"You should probably let the damalic know too"
np,0ff551825eefd6e6b2c3185f7e00b54f,0,0,1,0,0,0,0,0,1,0,0,0,0,0,"The paste h has been moved to"
np,156d76b3ddb329fee12850ad2c2ad0aa,0,0,3,0,1,0,0,0,0,0,0,0,0,0,"hi h m bosnia u"
np,1ceb0f81febc6a6b061247e9493a18bb,0,0,1,1,0,0,0,0,0,0,1,0,0,0,"hello"
np,69e2e9b6faa43ce63a2ecee941ecc641,2,5,35,0,32,0,0,0,5,0,7,3,-35,16,"I swear that one of these days going to go blow Google the fuck up I would if I could and now everyone knows why been saying for about a year that their programmers are fucking stupid their software is mostly very low grade quality you help only their support can their fucking Base bulk uploads are broken and I just wasted my weekend updating our tech to spit out correct feeds at computation time of h minutes per feed I had to compute recompute compute against the original verify then wait for their shit to work except it and they responded to my emails from last week first they told me I had h h acceptable products but I could only use h h even though the limit was h h then they told me that the size limit actually mb like they said but h and to mail them for an increase I but now their FTP reading my mb files then they marked my feed disapproved and refuse to read any more uploads and disapproved because they take my fixed feed and they take my fixed feed I have no idea why actually I know but their quality of service is next to h and of course then Google Talk another horribly written POS and Google Desktop responsible for more security vulns than any other software ever no not cool to write shitty software that novel yes you ever run it it looks like it took h minutes to write and really do anything that already done what Google desktop you know that certain security firms classify Desktop as a trojan because what it ends up being it also ends up executing things it when the MF vuln came out Google Desktop blundered into it head first heh also always forced to ask the question of why exactly do you need Google desktop I also understand prodigious need to use search an idea remember where you put your shit I have versions of Dig find and various other necessities tail grep"
p,a03edc2f70bbebc73ef3ba3f06968360,0,0,3,0,1,0,0,0,0,0,0,0,0,2,"Cool hoping sarah dont call huh Ok just gotta make sure we stay a secret In abit am going bathroom"
np,21b5b651c0acb1f1fe0a0e1afbebadf2,0,0,1,0,0,0,0,0,0,0,0,0,0,0,"hi im a guy"
np,b6415dfb21dbaf32bf5d6d4679baf59d,0,0,2,0,1,0,2,2,0,0,0,7,0,0,"yay successfully built trivial tunes playlist from python via episcopate 6bf6443c8d8d3dbd2e8798cefc00d963 are you a bot"
np,0ec2fbe2b69bf6d55bec70e94c75afc1,0,0,1,0,0,0,0,0,0,0,0,0,0,0,"hey baby asl now"
np,2de1d758a8d8bb577350a7857faf9e21,0,0,5,0,1,0,0,0,0,0,1,2,-3,0,"hey whats are the key differences between the h and h apart from the stacks crap more maps anything else i said h im trying to understand why the cubit port h costs more than x what the h one"
np,d520dd76fb5bcb5f282a8b878c976d12,0,0,15,3,0,0,0,0,0,0,3,7,-9,6,"is there a samba for windows yeah but so far i have only seen bins for lin bistros dammit well just that the normal windows networking on a box is faked i was wondering if there was a way to install samba that would get this box back ont he network damn thank for the info tho id ATN know sound like it tho supposing you wanted to make a sentient computer what would be the best programming language for that he he he bork fowk damn broke"
np,c3dae09b0ff69d2d58263d6786f0f123,0,0,2,0,1,0,0,0,0,0,0,0,0,0,"hi f"
p,d18fb2dc834414a71aace67bee91c432,0,0,34,0,9,0,0,2,3,0,0,8,0,26,"u still here www what ave u been doing loli did u take ben off block LAL dah well who u talking to awiwi ha ha did she ask u who i was yet LAL what did u tell her ha ha loli what di du all do to him LAL what did she say y love this girl but shes gone HA HA that www he loves u so you two never did anything dirty loli what did u all do with him again i know u told me before but i really forgot syr i forgot did u see his thingy rub it loli make stuff come out of it did u and thats all did he rub ur thingy u put it in ur mouth though right did u are u leeing loli u told me u never did that"
np,d870094992031b73ae14e4ccaa1a11cc,0,0,3,0,3,0,0,0,0,0,0,1,0,0,"hmm gimme a sec Lederer is god"
p,c1f43e1c992120a1c460b8ef7d0b4e9b,0,0,1,0,0,0,0,0,0,0,0,0,0,0,"hun where are you"
p,6f35a1f69fd4ae82056e4bc6a8a84575,0,0,1,0,0,0,0,0,0,0,0,0,0,0,"hey"
p,c62283536cf6261e5ffbcb323c8a2571,0,0,2,0,1,1,0,0,0,0,0,0,0,0,"call me if you can and wake me up"
np,b1000e87728e42e2ece748345a4004da,0,0,1,0,0,0,0,0,0,0,0,1,0,0,"tinyfacts"
p,6f35a1f69fd4ae82056e4bc6a8a84575,0,0,1,0,1,0,0,2,0,0,0,0,-2,0,"where are u cory i miss"
np,a4c57d7084e367d4ecb137633d143830,0,0,2,0,0,0,0,0,0,0,0,0,0,0,"asl h m eng"
p,6f35a1f69fd4ae82056e4bc6a8a84575,0,0,3,0,2,0,0,0,0,0,0,4,-2,2,"my Valentines Day song to u thinking of u alto today ill be on all night tomorrow and saturday night maybe u can call me and we can talk on the phone this weekend hopefully it would be nice"
np,b8810fee2f4a71f849f3f7409546d1d9,0,0,1,0,4,0,0,0,0,0,0,1,0,0,"opera makes use of the q deflate zip identity"
np,785b6c5eb00e035cb34e3f5a10887595,0,0,1,0,1,0,0,0,0,0,0,0,0,0,""
np,aeea4d0fa8f0cf3b66f95598e2e054e1,0,0,3,0,1,1,1,0,1,0,0,1,0,0,"h F Taiwan here hey"
np,980ffbae20a666d965bb171413352750,0,1,13,0,3,2,0,2,0,1,1,3,-4,4,"ya i thought you didnt want to talk to me anymore its ok tyum no do you did you have a good thanksgiving suck my gramma got mad that i was online so she changed the pW on the internet got home"
np,69b0d3dfe919a6b860a9fac82de52a7e,2,0,6,0,3,0,0,1,0,0,1,2,0,0,"should i suggest the toppings be sent as the former means explaining the the latter means explaining that it has a default only if the observer is buggy up to the application observers that implement CGI just pass the data to the script unparsed"
np,df4f9d68c321f7bdab7461e357c06dea,0,0,1,0,0,0,0,0,0,0,0,0,0,0,"hey"
np,0a39f78bcb297ab0ebe8a29c28bfed89,0,0,1,0,7,0,0,0,0,0,1,1,0,0,"of a of a"
np,661f0978adaef5d60f8a8b8e98107638,0,0,3,0,0,0,0,0,0,0,0,0,0,0,"hi m u"
np,72af1cb61d47fcc5d18402bf3d1c147d,0,0,3,1,5,0,0,0,1,0,1,1,-4,6,"nice post about to thanks hell yes minutes instead of h"
np,f4113d73c0b80c35c5e085e01f736ab4,0,0,4,0,1,0,0,0,0,0,0,0,-2,0,"bored where u at how far is that dude y cant u come then"
np,ac8eed6d77b64d7bc2b0edc969a49197,0,0,1,0,0,0,0,0,0,0,0,0,0,2,"so looks like i am going to create my first android app"
np,c89a67ba35fb1992336d0041cd269e8e,0,0,1,0,0,0,0,0,0,0,0,0,0,0,"hi from israel"
np,94ee2cb95cf3efc3d05c2107772a5d39,0,0,4,0,1,0,0,0,0,0,0,0,0,0,"how can I obtain physical coordinates of an object x and y relative to my resolution relative to the screen not to the client"
np,0fe8692be7a494c6561f745b9f3b0d17,0,0,1,0,0,0,0,0,0,0,0,0,0,0,"yo"
p,0599cd3f7fc15849844468b0702ff593,0,1,15,0,1,0,0,0,0,1,1,0,-7,7,"I have you I said hi several times and you didnt answer during the last few days It said you were online anyways how are you doing it is OK there are lots of good things to do what happened that is the first step towards healing let it go do it that is the only way it will heal yes I would love to suck a dick how did you do this week at school"
np,ced7ec2654058b3f8b783d7a9d5dad3b,0,0,2,0,2,1,0,0,0,0,0,0,0,0,"Are you Male looking for male Thats okay"
np,afd26a820a5cd2b379f3614e04c8587b,0,0,2,0,0,0,0,0,0,0,0,0,0,0,"hi same"
np,3f039b16e005caff151e73d432d141e6,1,0,14,0,7,0,0,0,1,0,0,12,0,1,"hi i am unable to resolve histonomy on my machine hwt sheld i do unknown histonomy when i try to ping i have entered namesever yes ok will it wont if sufficient to add only in resolve conf my DNS sheld be updated for oversure by the i am working remotely on that machine can i add using terminal ok can i add DNS entries in confix file of netinfo using terminal can u tell me in which file i sheld add my DNS entries expect differen r u getting me"
np,a9b326df4e6da61c5b6f5e1058be83a2,0,0,19,0,9,0,1,0,0,0,0,0,-2,7,"in natural languages what is the difference between lexical and syntactic or in the study of linguistics is there a difference maybe syntactic about sentences or grammatically complete utterances whatever the general term is for those aha thanks much thanks ok I was reading a text that describes compounds compound verbs Japanese compound verbs and it says there are two types of Japanese compounds one is lexical compounds which is the normal kind that most such verbs fall into the second time is syntactic compounds in which the second verb in the pair is a verb that relates to beginning ending or continuing something which verbs are apparently called"
p,e788b3a47e4d812ed26036a93272c134,0,2,5,0,2,0,0,0,0,1,2,5,-5,8,"well im wondering if u gin to turn out to be a good Lil slut for me well i dont really know if u dont even finger your pussy overnet like i told u to do i gotta get off of here just do what i told u to do so i can know how good u gin to be for me ok friend of mine just came over here TTL and do what i said baby"
np,4e63bbbffbcaf12608512401eaf11240,0,0,1,0,1,0,0,0,0,0,1,0,-1,0,"excuses his presence no longer seems to be needed"
np,7a5fb463c39fbf34fa0f268635745d4a,0,0,2,0,0,0,0,0,0,0,0,0,0,0,"hi m"
np,716ed147db7f4a11aed2832a51e72924,0,0,2,0,3,0,0,0,0,0,0,1,-2,0,"we all NEED to be BLEEDING Edge damnit missing something"
p,2a77f862a19d8d47d21692543e90dee8,0,0,1,0,1,0,0,0,0,0,0,0,0,0,""
p,c62283536cf6261e5ffbcb323c8a2571,0,1,16,0,2,0,0,0,0,0,1,2,-3,1,"hey up what are u doing thursday o ok be there at h motorium problems computer and not done packing computer working sorry sure got to be in vegas friday wheres your mom going to be she will be there thursday o ok maybe keel whatever you want go run around naked outside somewhere"
np,c89694f33fc4fb8686859f5210398092,0,0,1,0,2,2,0,0,0,0,0,1,0,0,"how are you"
np,df12f37ef0f45eed9876aca7e3654996,0,0,11,0,12,0,0,0,0,0,0,1,0,5,"loli at the topic i have a question about is this an appropriate place yes but my question is specifically about doing something declaratively it would be the same in any net language with why that work my custom control is receiving the it and sending that into my custom property yes i know done it before but not with a custom control prefer not to do this in the"
np,1cd0e5c0ae708cc463413ed4ca909129,0,0,1,0,0,0,0,0,0,0,0,0,0,0,"male or female"
np,23660bd5f4e1977fcecf4f4e97ad678f,0,0,4,0,3,0,1,2,0,0,0,1,0,0,"so the richest contr in the world is luxembourg gusto thats because it says here"
np,41fdc6e13a0057a5560a9dc1ac65c5b3,0,4,4,0,0,0,0,0,0,2,6,7,-15,0,"sissoo whats cracking which u think im sex dont u ur a cunt lick dick sucken ass whipping pussy specking retard use trojan my mon"
np,a9b326df4e6da61c5b6f5e1058be83a2,0,0,6,0,4,0,2,2,0,0,0,2,-1,0,"so noticing that the command attribute was in the original WF spec ah now no Web Apps"
np,97c3e1d5fab390dc73273a6020cd3148,0,1,9,0,2,2,0,0,0,0,1,2,-3,0,"hey h roleplay weymouth totally ik rite looking around seen if anyone wants to be a faggot who preys on little girls get a life man"
p,aebe7a87ad50fbad92d9931c49cae848,2,0,32,0,4,1,0,0,0,1,2,4,-2,4,"Hey Feel better Good Felt like eating final huh Good Yep Here too May be cold this weekend Me too Wanna see you in alow top Great Not if too cold Cool bring you a nalla cap bluecap so your hair blow all over Do you have sunglasses Cool Hate to see you cover those eyes though Exotic eyes Yep Uh huh they just beg to be kissed I do Lips too Thanks They need kissing too Damn I have to go on a fire call will you be on later See you then let you know when I get back so you can call Bye for now"
np,aea366dac07ce6bb27e024177c55168c,0,0,2,0,0,0,0,0,0,0,0,0,-1,3,"bonsoir i no speak english good"
np,5b8a284fa662b200c0d6b94314f7fc48,0,0,2,0,2,0,0,0,0,0,0,1,0,0,"Hey Folks using IRC through telnet again neighbourly just jealous"
np,ad2a244b2274304716b8dc9a118f7cb2,0,1,29,1,3,0,0,0,5,2,5,11,-4,19,"hi asl m yeah m or f ok u have MSN ok how old are u good i m coming ahh mog sexy girl darling ahh i can t see u thank s dealing ahh oh nice pussy i m with u lovely mog yeah IAH nice bobs so sexy come on ahh i can t fuck u"
np,b4edeff2f0525343f17649a63bd3e6b1,0,0,3,0,0,0,0,0,0,0,0,0,0,0,"hi asl m h"
np,542ebcbcf6ee466a1780913e2c800716,0,0,1,0,1,0,0,0,0,0,0,0,0,0,""
p,fac3a2081264f1dbb943eaf7165d8fc3,1,1,1,0,0,0,0,0,0,0,1,0,0,9,"hey sexy little lady hope u had a good night sleep any wild dreams just wondering wont be back until pm if your up if not i will just have to wait until tomorrow"
np,78ed0836ab36d5c6054a3186b6177339,0,0,2,0,0,0,0,0,0,0,0,0,0,0,"v DIBIDIBIDIS MY NAME IS Minho"
np,b98b14478fb4367c01a82fb1753d43d6,0,0,4,0,4,0,0,0,0,0,0,1,0,3,"well finally figured out my problem was being served via subdomains so I had to base encode yeah it even dawn on me that it would matter yeah probably do that instead"
np,94d50e2efa8ecc99acd742d7cdd18f4a,0,0,1,0,1,0,0,0,0,0,0,0,-2,3,"its fine pretty tired as well as busy"
np,459dad309f8a7b9844e2f74114d76048,1,3,36,1,8,0,0,0,1,3,8,5,-20,15,"hey asl u say i wont leave i sware i dont mind with any kinds ok h f u really h im in brazil im Carla THX im not like a girl u like im still very sexy and a bit fat very bit have big boobs but i am im a whore and a beastly do u like it no no because of my job oh THX i love to be fucked by human dogs and horses not very THX my tits and pussy is brown too suck me i am a girl why shes dead i have two sisters too wow THX we had done that once one h one h how much u will pay h"
p,a03edc2f70bbebc73ef3ba3f06968360,0,0,10,0,0,0,0,0,0,0,0,2,-2,6,"Yeah kinda Yay Did u fall back to sleep Am up going bathroom gosh loli Lola i wont Lola have u been bratticing standing up yet So u said u would loli Lola ur silly No ur silly Ok"
np,21c921d920ef756158e8148ed9ebe250,0,0,2,0,0,0,0,0,0,0,0,1,0,0,"hi male here ts ur asl"
np,fcba0d84b841d9342c4acfbd24feb820,0,0,1,0,0,0,0,0,0,0,0,0,0,0,"hi"
np,a4a6fec073d417a56fadbd987e758dcc,0,0,3,0,1,0,0,0,0,0,0,0,0,0,"hi where u from SLOW shitty"
np,f0dee2d81bd953a62bc6949504cd93dc,0,0,3,1,0,0,0,0,0,0,1,1,0,2,"yes please fag"
np,249837f7d6910a48cb02775aca1367d0,0,0,1,0,0,0,0,0,0,0,0,0,0,0,"come cam with me im blonde female goto"
np,bdedc97e25dde1328bae6e2d092691c8,0,0,1,0,0,0,0,0,0,0,0,0,0,0,"The first sign of The End of Days 4c681049601b3c374f1d2c0077c99049"
np,e9d5a573f13d1600950b9c6dcb031887,0,0,11,0,1,0,0,0,0,0,0,1,0,4,"Hi Cool h f US Haha not much here just trying to relax a little you wow I hm cause you Well that makes you perverted How"
np,bc0aa34af391847247e7ce56e537ffa1,0,0,2,0,0,0,0,0,0,0,0,0,0,0,"h m"
np,1f8387eb43f131d7c309a90a4e36b5cb,0,0,3,0,2,0,0,0,0,0,0,1,0,0,"announce it on In what context Well I know you can use"
np,0cc802eb28fe72308a33667022f88f0e,0,0,1,0,0,0,0,0,0,0,0,0,0,0,"you a dude"
np,aacb662ad94edd38444e1c44a727eca8,0,0,2,0,0,0,0,0,2,0,0,2,0,0,"ooh zzzzzzzzzzzzzzzzzzzzzzzzzzzzzz"
np,0ee1faace5e2a5be841794d5df0eda43,0,0,1,0,2,0,0,0,0,0,0,1,0,0,"I think preferrable to have only id be conforming if there any major As where name works but id for some construct"
np,8b3687499080633e1898fa1dd209ef81,0,0,3,0,6,2,2,0,0,0,1,4,0,0,"Sholley boo 00adb0702a98d60e91bee853adc4a0af done with Buxbaumia Sholley h includes Of which two are in DOMClassinfo"
np,cd3cba0d79a5f37472b8cb5d48bd01b9,0,0,3,0,0,0,0,0,0,0,1,0,0,0,"hi i am lesbian and u"
np,cbd96bfc4f60bc995b620a9fb2fb9ce8,0,0,1,0,0,0,0,0,0,0,0,0,0,0,"hi asl"
np,e9ae6ef5f1f407a22b2676c63dfbe0de,2,0,18,0,7,0,1,1,0,0,0,3,0,8,"ey so how old is u same here finally some one my age hahaha u funny me i am M U some ok i got one Mrs Patience is babysitting h kids and they all want a cracker and she only has ten but they told her to keep one in the jar how does she give them all a cracker cracking GA GA US wad up wid d naw k BYE"
np,501129286f005d343f2bf09c76af29db,0,0,2,0,1,0,1,0,0,0,0,0,0,0,"hi i need someone to talk to you think you could give me advice"
np,b8f8fd9e2c1cc15f0aeb9f7a02ebfb02,0,0,3,0,0,0,0,0,0,0,0,0,0,0,"hi From where you Decipher"
np,8405cb6920cccfd28423f763046130b9,0,0,3,1,0,0,0,0,0,0,1,0,0,0,"hello name is Rich from Florida"
np,f94f854949fc94f06c85986f1e814b34,1,0,1,0,0,0,0,0,0,0,1,0,0,0,"is there a widget toolkit uses html canvas"
np,a913a6503e893f9e53fa8f22924c7a01,0,0,2,0,0,0,0,0,0,0,0,0,0,0,"hey asl"
np,aed7195c2b12657708b6f35c5f018a5f,0,0,4,0,1,2,0,0,0,0,0,2,-1,0,"hey your so hot no answer"
np,05414ea5d094ccf30d8ab82457e019dd,0,0,2,1,0,0,0,0,0,0,1,1,0,0,"howdy witchmonger"
np,4d9dbb097e1b246db0c32d69da161ef5,0,0,6,0,1,0,0,0,0,0,0,0,0,0,"Hi M or f Hi How old I"
np,86f3b57bb0febe2c45106e450acf5880,0,0,1,0,0,0,0,0,0,0,0,1,0,0,"hiney"
np,e18fe3fe83f0af4d543290c27b72e548,0,0,2,0,0,0,0,0,0,0,0,0,0,0,"hi male here"
p,2d08262caa29b1bebeb24e9ad0c60ece,0,0,8,0,1,0,0,0,2,0,1,2,-2,5,"hey babe where have u been i was in LA looking for you last week i wanted to meet you it was my only chance for a long time please call me when u get a chance ok i miss you Soo much kissesssss Dan"
np,33efc1e92757da55a29793522ce54302,0,0,5,0,4,2,0,0,0,0,0,0,0,0,"mau h alpha is released soon final will be released soon h alpha is already there check it out if you havent yup"
np,a924fb58d2c25874322f4e5126f608b9,0,0,1,0,0,0,0,0,0,0,0,0,0,0,"Oh who taught Garrett about formal objections"
np,6103130184a5cb2706eb422698d9c151,0,0,2,0,6,0,0,0,0,0,0,0,-2,2,"could someone let me know what is wrong with make save the"
np,a00f302198ebe0f8c937d6c16675a246,0,1,3,1,1,0,0,0,0,1,3,0,-7,0,"h f india fuck your whole family and suck my"
np,fe40c15467b4e52ccde99b424133f34d,0,0,15,0,0,0,0,0,0,0,0,0,-1,7,"hi not much u cool what band cool they asl h m usa very interesting i am now i just had to do something quickly sorry have a nice day bye"
np,69b0d3dfe919a6b860a9fac82de52a7e,1,0,15,1,6,0,0,0,0,0,1,5,-11,6,"still no sign of sebastiana surprised as to your initial assertion is that really true ah ok my guess would be that it true and that there is no correlation between lack of alt text and importance of image right what macies said most images are spacer ifs according to my surveys but they all have names like anyway you can tell if an image is a spacer gif quite easily be transparent so that can be one of the heuristics the spec talks about my point is that i see that lack of alt text is any more of a legacy problem we face than is bad alt text looks"
np,ab7faae5d7b250ea8606486575f8f79c,1,0,5,0,26,0,0,0,0,0,4,6,-5,10,"About canvas there are quite a lot of simple cases where browsers differ like and and and and lots of and and loads more but I know which ones are worth trying to fix now for FF Opera I really like how the spec handles infinities in the transform functions it seems weird and confusing since just silently stop rendering and I expect be more helpful to have exceptions in those it looks like Opera does throw exceptions in those cases to the whereas Opera fireboxes throw and Safari h"
np,25812bf456959aa5f28dc570f341a3ba,0,0,1,0,4,0,1,1,0,0,0,4,0,0,"is baps and DAP this channel is"
np,e4861610d329149fea4f7bfe65b0ab4f,1,0,19,0,20,0,1,0,0,0,0,6,-4,1,"qt Morton connect what What is Marcus no in more than one file Both work Marcus I can paste all my source code though Yeso getIncrementValue has no parameters Marcus then how would that make sense If it says it needs an int it should accept a function that returns an int Marcus then what can you do It make sense that you set the LCD private variable Morton I tried it It work No such slot No such slot Marcus why is it that way Marcus how does that work Marcus does it have one Marcus what have you done about that problem Marcus that is a ridiculous issue with that gadget Morton how would I do that"
np,4762a096bcd263d27804435a482633ef,0,0,1,0,0,0,0,0,0,0,0,0,0,0,"hi"
np,0d68fa9bf66fb42fc4de152c1fc70053,0,0,2,0,1,0,0,0,0,0,0,0,0,0,"sup"
p,f069dbec9ab3e090972d432db279e3eb,0,0,17,0,5,0,0,0,1,0,0,4,-2,8,"i cant stay long i just needed to see u and say hi hi i didnt want to leave so fast either ok u r sweet i cant believe i gave u my number loli it is with me for sure check back in a Lil bint email me if i dont come back and u have to leave ok i did ok bye for now sweet cutin MMM u r something"
np,c3904daac1ed649a37c0895b138fe356,0,0,1,0,0,0,0,0,0,0,0,1,0,0,"hey"
p,48aad4b6baaba42d5ad3b77880d3cead,1,0,11,0,0,0,0,0,0,0,0,1,0,1,"barb yes i will when will you be on give me a time to check in at night why so late oh ok well i will check the whole day so let me know something whenever neither can i later"
np,b8810fee2f4a71f849f3f7409546d1d9,1,0,6,0,10,0,0,0,0,0,1,4,0,0,"Why does the spec for insertAdjacentHTML describe exception behaviour instead of we be speccing behaviour considering that their API and Opera throw either when the parent is the document object fact Opera throw even when IE the position string is I test other browsers when fixing bugs that tends to reveal spec bugs which prolongs my bug fixing time"
np,8f9c2a2c201a71056a2f9490b0a8d89a,0,0,2,0,0,0,0,0,0,0,0,1,0,0,"Hehe saw that a bit ago neither logo illustrates much about themselves"
np,3ac06133847da31261cdec66722bf287,0,0,1,0,0,0,0,0,0,0,0,0,0,0,"Hi I"
p,f069dbec9ab3e090972d432db279e3eb,0,0,1,0,0,0,0,0,0,0,0,0,0,0,"just looking for u"
np,9633046180999cceeb15fd9febeff72f,0,0,1,0,1,0,0,0,0,0,0,0,0,0,""
np,4c6a462246d0a095f12296c442174ecf,0,3,61,1,0,0,0,0,2,3,5,24,-11,8,"hi are u indian do u know Megan fox tell me tell me tell me tell me telllllllllllllllllllllllllllllllllllllllllllllllllllllllllllllllllllllllllllllllllllll ma yeh she so hot i want her pussy and tit loli i want every thing on her id pay dollars just to fuck her for h week i got big DIC so big i have sex before no relay hot are u a girl your a boy i know im gay gay do u want me common fuck me fax cad cd faq FD QF DW f Dq fwd f q f qed f Dq FD wf EDF EQ few fee cfc Fe QF EQ faq no your not i get girls h h ive had sex before u havent betainogen"
np,a5bc58e784058d9bd021e3c5dad6d0ef,0,0,4,0,1,0,0,0,1,0,0,1,0,0,"heii asl not cam"
np,111173ce53a1bb462fd50ea9f2f2f587,0,0,2,0,0,0,0,0,0,0,0,0,0,0,"hey asl"
np,3abe124ecc82bf2c2e22e6058f38c50c,0,0,1,0,0,0,0,0,0,0,0,0,0,0,"d"
np,178ec23ccabc5ed4d79ed8c76a3116da,0,0,2,0,0,0,0,0,0,0,0,0,0,0,"hi h female ohio"
np,b8810fee2f4a71f849f3f7409546d1d9,0,0,2,0,0,0,0,0,0,0,0,1,0,4,"it would be healthy for people to implement stuff and see that a namespace is just a string that can be compared for equality like"
np,25812bf456959aa5f28dc570f341a3ba,0,0,1,0,3,0,1,1,0,0,0,2,0,0,"is if you are new here add yourself to"
np,8d5c0dd1af8dbfd69120fd4882cb3a68,0,0,4,0,0,0,0,0,0,0,0,0,-3,2,"regarding the h months deadline a minimum not a maximum and it says an expectation with the public the original proposal was h months and we thought that it would send the wrong message out there is simply no chance from what we understood that the draft would move out of cr in h months"
np,8d102cab8535e4a2d9e4ef284cd63b16,0,0,2,0,3,0,0,0,0,0,0,2,0,0,"wondered if BrotherScript is actually PS in disguise Even then only on the mid and high range models"
np,6d05f0c2942adc25946a4b02b37ffa00,0,0,2,0,1,0,1,1,1,0,1,1,0,4,"oh matter is awesome"
p,4ab0a550ebb27f9a95e31ccbf0114850,0,0,5,0,0,0,0,0,0,0,0,1,-2,0,"kolo sure its been planed for awhile ill TTL sweety nite"
np,1651912376f152bc027afcbf48a0a276,0,0,1,0,0,0,0,0,0,0,0,1,0,2,"what browsers plan to support operatic"
p,a03edc2f70bbebc73ef3ba3f06968360,0,0,1,0,0,0,0,0,0,0,0,0,-3,0,"Sorry lost service"
np,465a3d99da963aef24f1bba6cd619375,0,0,3,0,0,0,0,0,0,0,0,0,0,0,"hey asl ok"
np,abe59155aa41ae19e4ea964e9dd4b200,0,0,1,0,1,0,0,0,0,0,0,0,0,0,""
np,67b8dbbd954f99b0be64bce6b421d195,0,0,1,0,1,0,0,0,0,0,0,1,0,0,""
