predator,senderID,letterLines,wordLines,numberOfLines,spaces,funkyWords,posEmoticons,neuEmoticons,negEmoticons,consecutiveLetters,alert,blacklist,misspelledWords,negativeSent,positiveSent,message
np,0ded3c5d7daaf36aa8c2e1d8479a0c5a,0,0,6,0,1,2,0,0,0,0,0,4,0,1,"yo it means not in revisioncontrol i guess let me check here you import if you want to put it under control else just delete the file if you wonna delete a file under control then you must Svan delete file to removed from the source control and then refile"
p,8cd850ea4215ee7c4b94b6bcc0bae593,0,0,10,0,1,0,0,0,0,0,0,1,-3,0,"u ever do stuff with an older guy b h ya but not in his ok call me when u can ok no not at all hey i ctg i got a call will u be on tomorrow a friend that is stuck i will look for you tomorrow bye Lissa"
np,ab923a89120c083e90d10b95fcf28dab,0,0,2,0,0,0,0,0,0,0,0,0,0,0,"hey f h Wana exchange pics"
np,8f9b2e9187880da4f3f0480bb3c5ecee,0,0,2,1,0,0,0,0,0,0,1,0,0,0,"hello asl"
np,a11aabeeceeae6b8cb5d12ea06b56554,0,0,2,0,3,0,0,0,0,0,0,1,0,1,"Radar is bug tracking software and they have their own proprietary Uri scheme for it so yeah As I said to Chris ages"
np,9375fe8f3360d8689626638eab59e310,0,1,10,0,6,0,0,0,1,2,4,3,-1,6,"hi girl as you like i can be normal or horny normal why no i am jut shot say that i am horny big enough are you sexy"
np,38e5971429bb0f30aa410ac1ae0bb9a9,0,0,1,0,1,0,0,0,0,0,0,0,0,0,"bdedc97e25dde1328bae6e2d092691c8 Okay"
np,edb259c0e0038f38bb200bc20c8cbf7e,0,0,3,0,1,2,0,0,0,0,2,0,0,3,"There are probably simpler cases that are not addressed is that a bug or actually needed got to love the web"
p,0599cd3f7fc15849844468b0702ff593,0,0,1,0,0,0,0,0,0,0,0,0,0,0,"hi"
np,a085d0720a9377fea2432388bf533ece,0,0,2,0,0,0,0,0,0,0,0,0,0,0,"hi asl"
np,ab5ef9e759975056b584acc5b75a38e9,0,0,1,0,0,0,0,0,0,0,0,1,0,1,"is this a god pale to chat about canvas"
np,85b16429e6c234ed3aad1a4d35054eff,0,0,2,0,1,0,0,0,0,0,0,0,0,0,"hi asl"
np,6d5f53ef0ca0e74cf9014b679d2f6ec9,0,0,3,0,0,0,0,0,0,0,0,0,0,0,"Faggot Gay is not the way Haha"
np,cc23b0361d37d1db4d04ad15a2157387,0,0,1,0,0,0,0,0,0,0,0,0,0,0,"asl"
p,e788b3a47e4d812ed26036a93272c134,1,1,14,1,2,0,0,0,0,1,2,4,-4,3,"hello im good and u well i was working on my comp but i got bored so i came online cleaning it out so i can reinstall everything over again something messed up on it and thats the only way i can fix it yep its just a long process tho anyway what have u been up to ok have u been keeping up with what i told u to do did u get your finger in the hole how did it feel it hurt so why didnt u get your whole finger in that pussy hole"
p,d18fb2dc834414a71aace67bee91c432,0,0,1,0,0,0,0,0,0,0,0,0,0,0,"u here"
np,4740fea2db3dc4ca0f5b85700b667819,0,0,1,0,0,0,0,0,0,0,2,0,0,0,"I am homosexual"
np,d94471d6ed604ce88a2f4593438b5329,0,1,1,0,1,2,0,0,0,1,1,0,0,0,"Looking h a girl that wanna flash her breasts"
np,77a20b56284a80818eed2b1d714e7b8f,0,0,1,0,0,0,0,0,0,0,0,0,0,0,"WELL ARE YOU READY Ray"
np,08c57cb4daa05ce54080c88a03f8f5e4,0,0,10,0,2,0,0,0,0,0,1,0,0,10,"mogiphonia u asl wow ireland good name u we corey good im kim lea"
p,9775a796b1ac00a2a756f530bf554582,0,1,15,0,3,2,0,2,0,0,1,6,-10,8,"no i ran off h ky me h ea sorry trying h keep my uncles dog outta trouble my pc room hes a Lil assoil like his owner loli a patball a patball hes mean i miss my dog she got ran over a couple months ago its ok hun its part of life i love you waw"
np,0a39f78bcb297ab0ebe8a29c28bfed89,1,0,1,0,5,0,0,0,0,0,1,0,0,0,"It has been brought to my attention by some browser vendors that browsers actually implement accessibility API annotations exactly the way the ARIA spec says instead they have default mappings from HTML directly to the accessibility APIs that t"
np,1f8387eb43f131d7c309a90a4e36b5cb,0,0,3,0,4,0,2,2,1,0,0,1,0,0,"Ary and Henri stated everything that I would have said yeah"
np,a7249565f480308e64f52a18cedf8978,0,0,1,0,0,0,0,0,0,0,0,1,0,0,"ask equiped"
np,d339f43b30d9e36d6fd0bda57c35ea7e,0,0,4,0,2,0,0,2,0,0,0,2,-2,0,"sorry im new on mysel and bhp how to create a database using Linux taking a look THX sorry in what directory i have to create the db mh so i have to do a bhp script with"
np,cc097e0d7183ae8436e7df709553c8c0,0,0,2,0,2,0,1,1,0,0,0,0,0,2,"points to thanks"
np,b26c698cb35f2b5a9a6caceac7a83fdd,0,0,1,0,8,0,0,0,0,0,0,0,-1,0,"how can i drop all packages from i have added a rule for every range is it possible to add a with"
np,d7ebcea89344cbd73c07eb41f58b3db0,0,0,1,0,1,0,0,0,0,0,0,0,0,0,"does it show the same if you try both of them but just one at a time"
np,4cd7628be301d3bd53540d3e09a748c8,0,0,2,0,0,0,0,0,0,0,0,0,0,0,"hi asl"
np,9c76c1e379841f84806ddb01d082d9bd,0,0,2,0,0,0,0,0,0,0,0,0,0,0,"hey what state do you live in"
np,41f07ac6f8b443ce70f405c10b8dbaa7,0,0,25,0,9,3,2,0,0,0,1,4,-1,10,"hey you first I was just about to ask that mk that h FUS kind of most of us texas Little Rock to be exact where from in the old kingdom are you from wow so what you wanna chat about name your fava subject little old me what do you want to know you mean as in colour red h we all like passion sort of come out of that most likely yes takes one to know one though no a steer"
np,8d52bf87a239352ba7cc0aba1035e393,0,0,1,0,0,0,0,0,0,0,0,0,0,0,"anne you around"
np,fdb93d315c7989b47056e2f5d5e28793,0,0,14,0,277,0,0,0,0,0,0,0,0,0,"h h"
np,15dd625ea124d5023039081a226cd7ee,0,0,1,0,0,0,0,0,0,0,0,1,0,0,"eat a wens"
np,1f8387eb43f131d7c309a90a4e36b5cb,0,0,2,0,4,0,0,0,0,0,0,0,0,0,"BHP has a special behaviour to handle it Without the on the name though it just gives you the last one"
np,8a27749477b06aa0ec46e444d0a0094b,0,0,3,0,1,0,0,0,0,0,0,0,0,3,"nice wanna be gay with me"
np,f50ff556110fdad3308d01def5b80f64,1,0,4,0,2,2,0,0,1,0,0,4,0,4,"ahh I wonder does azureous always will be going to be launched under Java oh if I wanted to port it to another interpreted language would be good The the platform JAVA Nola hum good that is a start"
np,f5137d105ccd11d3c4384e8e8573b3c8,0,0,2,0,2,2,0,0,0,0,0,2,0,0,"hi Marcos I have only one email in by unbox so I need to send more emails to myself to try"
np,4a722ba9665fe3ebecdfcf04168ae596,0,0,9,0,6,0,0,0,0,0,0,5,0,4,"hey guys not sure if here right now but anyways i remember who exactly but somebody was wondering about san francisco javascript neetup the other day i spoke to matt of the js today and he wants to organise one in february so if you want to talk let me know ohia sleep is for sissies oh neat you earned h hours of sleep then haha i am intoxicated right"
np,ab7faae5d7b250ea8606486575f8f79c,0,0,2,0,2,0,0,0,0,0,0,0,0,1,"If somewhere in the html5lib code where it could poke some value that I could read out again after parsing then I guess be easy enough"
p,a03edc2f70bbebc73ef3ba3f06968360,0,0,3,0,0,0,0,0,0,0,0,0,0,0,"Its ok K Ok"
np,ed19101243ed9b27c0096948ba0d39c6,0,0,2,0,0,0,0,0,0,0,0,0,0,0,"bonjour comment sa va"
p,89319407d854bb82113349ecf7ce3682,0,0,1,0,0,0,0,0,0,0,0,0,-2,0,"I miss ya"
np,77194253ee065122d06a4a8fecbc35bd,1,0,11,0,22,0,0,0,0,0,0,1,-3,2,"heh Not sure if this would work but the only thing seen close to what you hmm too sure then whoops a bad habit Although that still be the nicest Actually prefer a separate graph next to the table I like data presentation Uma a graph should be an image Think about it this The point of semantic markup is that people that just see the markup can still see the page properly right And that is precisely why a graph should be represented as an image given the capabilities of HTML Hi"
np,a06799ba5c7fbc1cd9f0fe0c683c6ee2,0,0,3,0,3,0,0,0,0,0,0,0,0,0,"Are you trying to use XOR across domains perchance OK Just thought ask"
np,8fa347e4ba54ea9b776709cfe25899b1,0,0,2,0,0,0,0,0,0,0,0,0,0,0,"hi asl"
np,9c750488e7ecad2003f92ff34f7d9614,0,0,2,0,0,0,0,0,0,0,0,0,0,0,"hey asl"
np,ca975e71ff07872e50780936de52cced,0,0,4,0,0,0,0,0,0,0,0,0,-1,0,"hi asl no sweden"
np,13c47a0cc59dae66726aaf0990ce30f0,0,0,1,0,1,0,0,0,0,0,0,0,0,0,"r u a indian"
np,c623db8624e0859f818548866015194f,0,0,2,0,0,0,0,0,1,0,0,1,0,0,"heii asl"
p,fac3a2081264f1dbb943eaf7165d8fc3,0,0,12,0,2,0,1,0,0,0,0,2,-3,5,"U back where u run off too lucky room got something to eat Alson hung out here wondering where u went so how close was i with my numbers on you early so was i at least close for the top not bad from looking at a photo u supressed"
p,b679fca2e3690b4d3c60815edf4e3ca5,0,0,2,0,5,1,1,0,0,0,1,3,0,3,"Hey from misspace I just figured out your messenger thingies on your profile Duh heehaw Add me ok Hey sexy"
np,f27c48d989618af5a7e80d8be47ff8b7,0,0,2,0,0,0,0,0,0,0,0,0,0,0,"heii asl"
np,0b7b4dd2eb58202a9207616bd7cbcea4,0,0,2,0,0,0,0,0,0,0,0,0,0,0,"Hey where r u from"
np,f139aba52f9fa1394b4034a7954b2220,0,0,7,0,9,0,1,1,0,0,3,2,-7,6,"cc097e0d7183ae8436e7df709553c8c0 a quick summary of the arguments so Different linguicas have different quoting conventions nested quotes and mixed languages make things more complex Various solutions proposed ranging from defining explicit quoting rules to no quoting to dropping now you missed anything personally prefer to drop it at this stage But in any case the rules for rendering quotes need to be defined in which case like the spec to say render no quotes But since IE will be rendering quotes now we might be stuck with defining something else like always using the curly double and single quotes by default if there are use cases to justify it then it could stay in HTML But there been any compelling use cases presented yet but I think if it renders quotes by default then it will make it a less valuable solution even if there are use cases for it"
np,53e7e8d3fca41ff2c52fda7ec5cdb734,0,0,9,0,6,0,0,0,0,0,0,4,-2,4,"hi anyone use azureous on Linux because mine is messing up the little Popp box keeps getting stuck im on fedora c and i installed the proper java from oh right try it when it pops up again loli how do i give it focus k trying it out sorted it I can close it with the mouse yeah"
np,8624ca69b1aad21e83f718578846050a,0,0,141,0,141,0,0,0,0,0,0,0,0,141,"yes or no yes or no yes or no yes or no yes or no yes or no yes or no yes or no yes or no yes or no yes or no yes or no yes or no yes or no yes or no yes or no yes or no yes or no yes or no yes or no yes or no yes or no yes or no yes or no yes or no yes or no yes or no yes or no yes or no yes or no yes or no yes or no yes or no yes or no yes or no yes or no yes or no yes or no yes or no yes or no yes or no yes or no yes or no yes or no yes or no yes or no yes or no yes or no yes or no yes or no yes or no yes or no yes or no yes or no yes or no yes or no yes or no yes or no yes or no yes or no yes or no yes or no yes or no yes or no yes or no yes or no yes or no yes or no yes or no yes or no yes or no yes or no yes or no yes or no yes or no yes or no yes or no yes or no yes or no yes or no yes or no yes or no yes or no yes or no yes or no yes or no yes or no yes or no yes or no yes or no yes or no yes or no yes or no yes or no yes or no yes or no yes or no yes or no yes or no yes or no yes or no yes or no yes or no yes or no yes or no yes or no yes or no yes or no yes or no yes or no yes or no yes or no yes or no yes or no yes or no yes or no yes or no yes or no yes or no yes or no yes or no yes or no yes or no yes or no yes or no yes or no yes or no yes or no yes or no yes or no yes or no yes or no yes or no yes or no yes or no yes or no yes or no yes or no yes or no yes or no yes or no"
p,1d911cc805cce729269c8d357dc0f0fe,0,0,21,0,0,0,0,0,0,0,0,0,-5,3,"about what nothing u no about what about what ok then leave u wanna meet i wont meet u at ur house yeah maybe do u only like older guys would u see a guy under h no stop asking what do u have money can u get a taxi u said no when i asked to meet u at the park ok meet me at the park h yea do u"
np,4651a4fbb52af3c944288c36ad7c873b,3,0,12,0,8,0,1,0,1,0,1,4,0,0,"i think most people just use serveralias for that if its just for www i would use serveralias thats not what apache is for apache is a web server where do people come up with this crap why uh ok you mean madderwort okay you were already told how to do that scroll up dont you have work to do cool"
np,6f532bc1530676e0cf6ea16c1644d6eb,0,0,2,0,0,0,0,0,0,0,0,0,0,0,"asl no"
np,b25b6b77a0087ff8385941e5545d32ea,1,0,2,0,1,0,0,0,0,0,0,0,0,2,"not aware of any off the top of my head But I have rather less than encyclopedic knowledge on the subject"
np,b8810fee2f4a71f849f3f7409546d1d9,0,0,2,0,3,0,0,0,0,0,1,2,-3,2,"no way browser vendors would pull support though so it needs to be specified and implemented yeah not too crazy when only one level of it"
np,3471753f2be526c22cf883aa9d24d9e1,0,0,2,0,0,0,0,0,0,0,0,0,0,0,"hi how r u today"
np,d531f9bd28a3599cb52dcd03330a9a39,0,0,3,0,1,0,0,0,0,0,0,0,0,0,"l asl"
np,65155a370c653f5fb9cb70ceff32710c,2,0,7,0,7,0,0,0,3,0,0,3,-5,2,"you as yet i would think so the ones provided at require nevada b at a minimum i stand corrected we use the VPN stuff well as something that we are building but there is no x client for it VPN on SPARC is not bad improvement on but as i said no x"
np,f0dba42672ff0f3d69c250f017bbebd6,0,0,3,0,0,0,0,0,0,0,0,0,0,4,"hi fine thanks you"
np,3af609113e831f7b3ac542619c1f9ace,0,0,3,0,2,0,0,0,0,0,0,0,0,0,"hi girl r guy"
np,d69dc8c061f6093da232e19c85e6b5f2,1,1,32,1,28,0,0,0,1,0,1,10,-4,5,"What the hell GreatLord. Am I the only one that regression tests I have my own pile of regressions mikve PuTTY installer some PuTTY bugs QM and AAAAAA down on the list abord emu hardly works anymore FWIW added to BZ but top priority for me is mikve bima called paxilla USE IT back Real hardware How much ram YEs you dare oh h networking has been intermittently working on and off for me even I buy it try h times does the same thing How the are you even running trunk input work at all for me none yet Which has nothing to do with networking you use VMR you lucky input works at all probably"
np,0b8b5edaf91c9c1c620a330569dd441f,0,0,2,0,0,0,0,0,0,0,0,0,0,0,"hey where are you from"
p,c62283536cf6261e5ffbcb323c8a2571,1,0,11,0,3,0,0,0,0,0,0,1,0,0,"having on there k Ty hang on ok let me do it chat with u tomorrow be on my web cam h ok"
np,de485d95ce3dbfaa5457c4adfda15943,0,0,2,0,0,0,0,0,0,0,0,0,0,0,"hi asl"
np,019d8a52103cc1004cff36d3751a1c8f,0,0,2,0,1,0,0,0,0,0,0,0,0,0,"hi there how are u"
np,f85318ad787da3cb71cf7ef25c51690e,0,0,1,1,0,0,0,0,0,0,1,0,0,0,"hello"
np,88d4d34a8064a4ff39fd5e144eea7762,0,0,1,0,1,0,0,0,0,0,0,0,0,0,"hurrah"
np,4fff72a55ff2b835a20569d34d5a0b3b,0,0,15,0,6,3,1,0,1,0,0,3,0,1,"hi wanna talk about philosophy doesnt matter where r u from germany im not a native speaker h m the omnipotent SENSE OF LIFE xD its not in what do u think consists the sense of life what r u living for in this noo i do you live for your wife or for happiness for god for whatever"
np,1236d3dc8060cd1962f03e8f3438f4fa,0,0,3,0,1,0,0,0,0,0,0,0,0,0,"hey asl h f usa"
np,8d11e6adaf4f6e17ae029ff039bcb31d,0,0,7,0,9,2,1,0,1,0,0,0,-3,1,"up h days h user load at home obviously not its a laptop a big old dell one the external disk in the docking station died about h years ago still going though"
np,ee2ca07ee7fe5e8f0aa73dab518aeba5,0,1,4,2,0,0,0,0,2,1,2,1,-3,0,"hello hello hello argh you suck at this game"
np,f6222d6c5bf5fc41553a79eaa36af9cc,0,0,2,0,1,2,0,0,0,0,0,0,0,0,"hey asl"
np,23b56cc46f7e66805b05b6f4fa784f45,0,0,2,0,0,0,0,0,0,0,0,0,0,0,"hi f"
np,000eaccce4e046539c682226173430ea,0,0,1,0,1,0,0,0,0,0,0,0,0,0,""
np,181dbea5b98a3a305cf438d22f208b56,0,0,3,0,0,0,0,0,0,0,0,0,0,0,"hi asl asl"
np,da8387555a2ec411874128dc6754ec7c,0,0,3,0,2,0,0,0,0,0,0,0,0,0,"hi asl"
np,617a131e2d3d3616b32f9afce35f0949,0,14,13,0,1,0,0,0,3,0,0,0,0,0,"SHUT UP IM NOT A FUCKING ASS HOLE GOD DAMN IT coedited FUCKING DAMN edited ILL SHOW YOU A FUCKING ASS HOLE MR FART FACE YOU EVER BEEN FUCKED UP THE ILL SHOW YOU MY FUCKING CHODE AFTER I FUCK MICKEY Ouse SHIIIIIIIIITTTTTTTT YOU THINK YOUR FUCKING CLARK KENT OR SOME SHIT PRICK WELL I FUCKED YOUR GRANDAM SHE TRIED TO FEED ME SOE FUCKING SOAPS I SAID NOW"
p,c62283536cf6261e5ffbcb323c8a2571,0,0,4,0,1,0,0,1,0,0,0,1,0,0,"just wanted to let you know cancelling my internet Tuesday guess your not coming on bye"
np,51c1edab440268cdb0754ff0c4584a9f,0,0,14,0,14,2,0,0,1,0,2,10,-2,7,"make malines err actually that was like or something as I said if you have libxul enabled I know my suggestion is wrong a brief thinking about khuen might be able to tell you which to build to relink libxul so make malines very hackly Soo whats the pref to make sessionrestore only load tabs on first use rather than on boot I bet galantuomo would know that answer great thanks o hia its in the UI will be back soonish rebooting restarting"
np,1d78a130fa6978310d791bc8f258dafe,0,0,1,1,0,0,0,0,0,0,1,0,0,0,"hello"
p,fac3a2081264f1dbb943eaf7165d8fc3,0,1,3,0,3,2,1,0,0,0,1,1,0,18,"such sexy photos u have love then all hope u had a good evening good mooring it is yes i am up that early love your last h photo u had up also wanted to say the i think your a for your measurements"
p,03957f443c7790f9642db14bbc59df11,0,0,1,0,2,0,0,0,0,0,0,0,0,2,"back I hope you come back on soon"
np,2935f402157787e263ebbf00a5f724e7,0,0,1,0,0,0,0,0,0,0,0,2,0,0,"Nerti apa engaga"
np,b844a0a98f81c321afe1d38ae37f3c28,0,0,1,0,1,0,0,0,0,0,0,0,0,0,"channel"
np,6c3f141a0f507bef82e6efb7e89503c0,0,0,1,0,0,0,0,0,0,0,0,0,0,0,"hi"
np,8dc54c1aa02397c5e1df899648ededb2,0,1,26,0,4,2,1,0,1,1,4,3,-3,35,"hi asl h male usa i think so what do u mean by nice haha so whats up what state do u live in hahaha me too what town Easton u oh thats not to far so what r u up to on Ameagle this late haha oboval most people have a more interesting response haha haha the most common is people being horny r u horny wait so if i say yes then u are but if i say no then u arent haha well in that case its a yes haha yeah what r nods loli oh haha well so ur horny so what should we do about this haha well ill email pics if u do too"
np,febae8580db21fbcd87f7cb5b189c61e,0,0,2,0,1,0,0,0,0,0,0,0,0,0,"Hey asl"
np,1f8387eb43f131d7c309a90a4e36b5cb,0,0,3,0,7,0,0,0,0,0,1,1,-15,0,"Argh dammit I can't reproduce the damned Moosup errors Also dammit Chrome now does XS protection that hurts live dom viewer Okay discovered the problem at least one of It was being fired too mucho worse getting fired directly at the"
np,745b270ba68df94019de986d71708d1c,0,0,2,0,1,0,0,0,0,0,0,0,0,0,"hey Froma"
p,850f47f5c88b660f1b096785ddc197a1,0,0,12,0,2,0,0,0,1,0,0,0,-12,4,"Hey what happened to you here loli no at home yeah I see you on line all week so I got worried awiwi I missed you babe I was afraid to leave without checking in with you one last time Hey worry I will get down there can you call me"
np,b8810fee2f4a71f849f3f7409546d1d9,0,0,1,0,2,0,1,1,1,0,0,1,0,3,"is amused by description of how to find him"
np,5d5b78699e57104f2fa03bbdf7b9197b,0,0,1,0,1,0,0,0,0,0,0,0,0,0,"by Anvik on Mon Oct h"
np,fb8bd208a9f4deb4bf2471176fccd2af,0,0,1,0,1,0,0,0,0,0,0,0,0,0,"Hey Asl"
p,fac3a2081264f1dbb943eaf7165d8fc3,1,1,22,0,0,0,0,0,0,0,2,2,-6,11,"little miss sexy how are u doing this evening just ok me great not for u and u no i am not boring and yours how was school learn any thing today k so how are u doing smiling at u yep so what are u doing have any homework problem got it done already i c so whats on your sexy mind actually was waiting for u but i Fugere that you were doing your home work"
p,23bffbccce4e395053495c68a5e15b68,0,0,19,0,5,1,1,0,0,0,1,1,-4,16,"hey u hung up on me u gonna call me back try didnt you like talking to me and so did u u sounded sweet and sexy when u call me back no it didnt even talk h minutes I will take ya to buy another one so dont worry about that I dont even know where you live though when u call me back how long does that been almost h hrs well they dont take much more than h hrs doesnt sound like you are to interested how well wedidnt even talk h and I do want to come over but want to talk a Lil more than h minutes on the phone h minutes or I want you to save a Lil for when I am on my way tomorrow so u can call me and see where I am at"
p,a03edc2f70bbebc73ef3ba3f06968360,0,0,1,0,0,0,0,0,0,0,1,0,0,0,"Kisses"
np,002fd66affb058c756926402acf97570,0,0,4,0,6,0,0,0,0,0,0,0,0,0,"They surrogate pairs Surrogate pairs only exist in and exist in the abstract Unicode string in which character references occur already decoded that from the source Yeah character references have to match a character that matches Char in XML"
np,3d2d800163bd186050b12164fd979515,0,0,16,0,4,3,1,0,1,0,1,2,0,2,"me either although with my nav I had to add I used home already Ill replace it with a h then psuedo and class I know I should be using content instead of home for each page on profile i use profile instead of home URL clear them try it oh mmmm yeah I know are the images images or background images"
np,db9fc3d330e0787a7828c856b2500b7e,0,0,2,0,1,0,0,0,0,0,0,1,0,0,"hi"
p,c62283536cf6261e5ffbcb323c8a2571,0,0,1,0,0,0,0,0,0,0,0,0,0,0,"hi"
np,350668f5497fdc5196aae810b2f70074,0,0,2,0,1,0,0,0,0,0,0,0,0,0,"hi"
p,6283fab0062e2eb309261acf647abd98,1,0,21,0,0,0,0,0,0,0,1,1,-16,10,"yea im suppose to go and meet up with my friend soon no its a guy we have been friends for the past h yrs did u think i was gay what is that suppose to mean im not gay and it is not a date we are exchanging music u kind of made me mad for a second there ok no fighting minotaurs hey yea im kicking ass no i am not mad at u dont get so jealous i promise we will meet as long as u want to meet me because ur always thinking of me going on another date o really i think u already have stronger feelings for me o thanks yea i cant stop playing i am getting new powerful moves yea i am but it will be a very long time"
np,73eaf221abca1b8244e34b0b9e76ac46,0,0,1,0,1,0,0,0,0,0,0,0,0,0,"any progress"
np,c1ff16a3ff106fb137a0295c8790c76f,0,0,3,0,0,0,0,0,0,0,0,1,0,0,"hi Cmon we aint got time for salt"
p,c62283536cf6261e5ffbcb323c8a2571,0,0,2,0,0,0,0,0,0,0,0,0,0,5,"big hug kiss"
p,23bffbccce4e395053495c68a5e15b68,0,0,1,0,0,0,0,0,0,0,0,1,0,0,"ok then when u call me back u can give me your Addy"
np,ce5e5cd235ac870db603cb0c0af3b08a,0,1,2,0,3,0,0,0,0,1,1,0,0,0,"Are a horny teenage girl hi there"
np,465f10ee4f5895d6220d5c935999f179,0,1,17,0,6,2,0,2,0,1,2,0,0,6,"Hi f im h u ok the netherlands ok yea sometimes loli there is much rain over here yea whats your name Michelle thanks I need to go have to restart my laptop for an update you can add me on MSN if u want"
np,98acda1d0180e11a8918edacbf306a82,0,0,2,0,0,0,0,0,0,0,0,0,0,0,"hi where from"
np,e3fb62ebfa4f36acf5cbff6a6ed0f2e0,2,0,5,0,6,2,0,0,0,0,0,0,-2,8,"I suppose since we cannot directly support what is there now obsoleting it would work dunno exactly I researched it I really see how that would help implementations how that would help authors trying to use the feature and finding that it fails etc It might help new implementors avoiding the feature I suppose"
np,e2f20c6198524d86bf3d4675a747aa0d,0,0,2,0,0,0,0,0,0,0,0,0,0,0,"hey asl"
p,fac3a2081264f1dbb943eaf7165d8fc3,1,2,32,1,4,2,1,0,0,0,5,4,-12,12,"u there shame on u texas h room what your bored with me too then yes i have been for about h min you show your not on either i c that it was ok just looking all just looking waiting for u to get online miss u last night got home early last night oh it ok i am not mad or any thing typical st day lot of anhydridisation what they expect stuff like that so he let us go early most of the ones in the class did not have the basic stuff not at all so little miss sexy what are u wearing sexy me in a cut off texas longhorns t shirt and blue shorts yep and cause talking to you a sexy little lady so who was school how class of h but only h showed up one she is in a little more aventanced stage"
np,0a39f78bcb297ab0ebe8a29c28bfed89,1,0,1,0,6,0,0,0,0,0,1,0,0,0,"The spec currently seem to handle the situation of seeking to a point beyond the end of a stream whether by advancing monotonically to that point or arbitrarily seeking to that point"
np,7a205621b91e4878465075e964d2b1e8,0,0,5,0,10,2,1,0,1,0,0,2,0,8,"best gift site ever your question i love the canvas element like really love it hawaii"
p,609f7b8e566e8d514eecf112d3d3bc95,1,0,2,0,0,0,0,0,0,0,0,0,0,3,"u sleep well i love you"
np,7efbbd651b862a475aa5ce37f43ee467,0,0,2,0,0,0,0,0,0,0,0,0,0,0,"hi asl"
np,edb259c0e0038f38bb200bc20c8cbf7e,0,0,2,0,1,0,1,2,0,0,0,2,0,0,"I initially thought was about 65325d50b2e25aca54bc871b89758c9c oo"
np,d9c27b9f14c6cc5569a874b02f923cf9,0,0,1,0,0,0,0,0,0,0,0,0,0,0,"hey"
np,6f29eb1a7dd797994b01aacea56f3cd5,0,0,1,0,0,0,0,0,0,0,0,1,0,0,"oh i will figure something out"
p,fb169d16c42ca83583dd05b3f4d7fc98,0,1,25,0,4,0,0,0,0,0,1,3,-13,26,"you there you got quiet on me so you sure you want me to come over on friday you got any new pics yea i had seen most of those loli so how old are you again yea i just wanted to make sure i just need to watch my ass loli i am h ya know loli so what ya wanna do on friday wanna go get some lunch when i get there loli no keep the money its all good i figure since we both just meeting each other being in a public place might be a Lil bit easier to talk ya know since we arent just alone loli no im making you walk no silly is there a mall by you really that sucks malls are always fun your friends can see you with some guy whoas h years older than you loli westland how do you not know the name of a mall by take it you dont go there very often its a thats gay right"
np,2cc864c76a01fdb21490303c5b52e630,0,0,5,0,1,0,0,0,0,0,0,1,0,3,"stenosphere design me a layout nah do it for you loli"
np,0f23dd8ef7f6bb4d0ad3082646befe50,0,0,9,0,5,0,0,2,0,0,0,2,0,0,"haj Yeso Soo how you doina h f sweden You tell me ES YES Yeso What fantasy oh I thought you meant a fantasyroleplay Like lord of the rings"
np,77cdddb8c28c43475bec8161d86f53e7,0,0,2,0,0,0,0,0,0,0,0,0,0,0,"BRAZIL thats what everybody says"
p,c62283536cf6261e5ffbcb323c8a2571,0,0,2,0,2,2,1,0,0,0,0,0,0,0,"ok be on at eating to"
np,03ca748a82ad82c7cfe459600d9665d2,0,0,3,0,0,0,0,0,1,0,0,1,0,0,"hey h f usa you"
