predator,senderID,letterLines,wordLines,numberOfLines,spaces,funkyWords,posEmoticons,neuEmoticons,negEmoticons,consecutiveLetters,alert,blacklist,misspelledWords,negativeSent,positiveSent,message
p,5778ac8dcffe9bbacf3c0415fdb362d6,0,0,1,0,0,0,0,0,0,0,0,0,0,0,"hold on"
np,3c5af5405d2d16922aa91c87f8403492,0,0,2,0,0,0,0,0,0,0,0,0,0,0,"hi m"
np,65da79af6a32e9de8cc317109c5a4636,0,0,2,0,0,0,0,0,0,0,0,0,0,0,"hi asl"
np,b86c2018c7e8a2d1703570ad735de185,0,0,1,0,0,0,0,0,0,0,0,0,0,0,"Hey"
np,6047322a3c1b12484f972b2cf98e21fe,0,0,3,0,0,0,0,0,1,0,0,1,0,0,"m h india Yuu"
np,b8810fee2f4a71f849f3f7409546d1d9,0,0,1,0,1,0,0,0,0,0,0,1,0,0,"is your code for generating inputs that visit various tokenize states publicly available"
np,f4f1003ab53840254ccb8af51c1e02b3,0,0,4,0,2,0,0,0,0,0,0,1,0,0,"got a q about the ApplicationCache interface about the item method what does it return the URL"
np,25812bf456959aa5f28dc570f341a3ba,0,0,1,0,3,0,1,1,0,0,0,0,0,0,"is if you are new here add yourself to"
np,92df0ba5d7e624d9b06a9db1a82bb1f7,0,0,2,0,0,0,0,0,0,0,0,0,0,0,"hi you a fat person from VT"
np,75554836bdcb8fabf0df9b8172ffd27d,0,1,12,0,1,0,0,0,0,0,1,2,0,11,"have you ever wondered whats out there and you are a paedophile good sir and a gay one god will smite you yes he will in space we live in an environment that supports life and space is endless so isn there that could support a society much like ours probably im not sure though i don"
np,5fae07c419914bc7a4999afa97e0c882,0,0,1,0,0,0,0,0,0,0,0,0,0,2,"Hm how do I install support for Russian"
np,b8810fee2f4a71f849f3f7409546d1d9,0,0,1,0,1,0,0,0,0,0,1,0,0,0,"hmm apparently the WC survey system uses colons in ids"
np,2cc83be0233de2f6f7813e9af67fd5de,0,0,1,0,0,0,0,0,0,0,0,0,0,0,"why is"
np,5d338229d3984bed4a97854f8cfc9cae,0,0,3,0,1,0,0,0,0,0,0,0,0,0,"hi m h u"
np,3f2e2531201cfbf853f16f668132eaf2,0,0,1,0,4,0,0,0,0,0,0,2,-3,3,"Indeed just sampled from the pages linked from chosen by human editors as adequately interesting pages so be biased towards entry pages to sites rather than deep content of more limited interest"
np,1f4eb3acb8f7b816bf77b8398e61655c,0,0,3,3,0,0,0,0,0,0,3,1,-4,0,"help hello fuck"
p,e4c7c376bbd07aeb4a59684a2b94a664,0,0,4,0,1,0,0,0,0,0,0,0,-2,0,"I miss you baby How are you Sorry I havent been on much"
np,6e0b43f95c6dc01b211577d9c216a198,0,0,2,0,1,0,0,0,0,0,0,0,0,2,"looks like a little head with hands in the air"
np,1d72111d14fe0ddc08d64f1f6c86d6df,0,0,2,0,0,0,0,0,0,0,0,0,0,0,"hi h m China"
np,d1be857a7b94a2a7b33fe6bce3753a94,0,0,2,0,0,0,0,0,0,0,0,1,0,3,"hoho loli asl"
np,e9fe2a8ed6a64844a5c024b6f688d024,0,0,9,0,12,2,1,0,0,0,1,6,0,3,"ah very similar to do you have somewhere how reacts to selections in Efram's cool just write up something that makes sense for shadow DOM is a similar ah so not similar yikes why is getSelection on both window and document probably maybe 88d4d34a8064a4ff39fd5e144eea7762 knows fascinating"
np,0d56abb4e17164800c00f9dd60377422,0,0,3,0,1,0,0,0,0,0,0,1,0,0,"hey asl PLS"
np,b8810fee2f4a71f849f3f7409546d1d9,0,0,6,0,11,2,2,2,0,0,0,5,0,5,"in equiped working on it yeah people tend to point to the validatory which is why it important to have a conformance checker instead of a mere validatory we need better marketing of the nature of the spec on this point cc097e0d7183ae8436e7df709553c8c0 wrote a style sheet to that effect"
np,573bb0f1588cb206e89f7da471c78ec4,2,0,10,0,13,0,0,0,0,0,0,5,-3,4,"isodef windows for workgroups h h does not support domain logins if u are using run it on a nt or XP machine that is joined to the domain and u must be loggin in as root to use isodef windows does not support domain logins windows for workgroups note the workgroup part why would anyone use windows i havent used it in a very long time but there were no such thing as domain controllers when windows was around needs to be ran on a nt machine as root user joined to the domain failing that try LAM Ldp account manager or ideal samba console they are web based"
p,48aad4b6baaba42d5ad3b77880d3cead,0,0,15,1,0,0,0,0,0,0,1,0,-4,9,"hi stranger whats new same you back yet what happened damn so when do you want to see me ok just give me a heads up well depends on you what would you want to do ok then we have fun well like what we talked about ok i will tell you what i will do whatever if you tell me barb i said i wont change my mind you tell me what you want and i will do it i did"
np,c1118603da0319aa01d77bd8100d87b5,0,0,2,0,0,0,0,0,0,0,0,0,0,0,"Hi How are you"
np,d347426c92313292ffa36301729bf5fb,0,0,6,0,0,0,0,0,0,0,0,0,0,8,"hi channel good question Hehe is trunk compiling again cool wow"
np,edb259c0e0038f38bb200bc20c8cbf7e,0,0,10,0,7,0,2,2,0,0,1,1,0,11,"b19bfcbd7b695025e49d546be54e168b thanks BTW the default style sheet will be b strong presumably or maybe for hmm not like browsers show much of a difference between the various font weights i guess the easy yeah hmm Safari support b19bfcbd7b695025e49d546be54e168b not sure I understand what saying as far as default styling goes pretty much locked by legacy"
np,667636001c4a185c3f5dda7eaa2c3599,0,0,2,0,0,0,0,0,0,0,0,0,0,0,"hi asl"
np,65325d50b2e25aca54bc871b89758c9c,1,0,8,0,13,0,0,0,0,0,0,0,-1,18,"I think the basic model seems sound I just want to think through some of the details with respect to if you want I can come by and we can discuss with a whiteboard 4124bc0a9335c27f086f24ba207a4912 would be interested as but try to write up some comments first very interested in having offline stuff in the spec soon 69b0d3dfe919a6b860a9fac82de52a7e would you guys be free this Friday around lunchtime early afternoon perhaps my other free times are either next week or after PM on Thursday I wanna have lots of meetings Safari team is super busy too pretty much all the but it seems like one small one might help ok then how about send comments in email and we can sync up in person next week if we have time and think useful"
np,d2458157aca157b9e806d7f5445d3efe,2,0,25,1,19,2,1,3,1,0,0,1,-6,6,"hey Jimmy stuck with a problem for days could you have a look about rendering from the command line got it figured out this is the command it works for the most part but the parameter says where the render should be saved and that work i say it should render to it renders to exactly there is such an option i know if you use windows but if you run get the help and it says parameter does exactly that there is probably something like that in ubuntu so read the option you odd well i have to go singing here so see you later"
np,67d66e76642dd1c5a7ef7ba5c1987994,0,0,1,0,1,0,0,0,0,0,0,0,0,0,"h f u"
np,0fe8692be7a494c6561f745b9f3b0d17,0,0,4,0,0,0,0,0,0,0,0,0,-1,2,"is it just me or are startups way overhyped no this is nothing related to dev work just all the stuff always seeing related to them on HN like startups are a hot trend"
p,13ff9f88ad6e1242f30cb4c7d4a36ed7,2,1,24,0,4,0,0,0,0,1,0,5,-6,21,"i have to be out of there sunday afternoon no cant Thurs day have to make it friday its ok thats two days how about your grandma what will u tell her will she beleave u then ya if u can that would be cool what ever you want to u said u never slept with a guy this will be a learning experience i will make it as special as i can ok we will mess around with other suck kiss each i can get some its cool ya theres all kinds see ok ya ha ha what ya just like a sabora it will be a good weekend of what tell me what happens in the dream like fun ok"
p,c1f43e1c992120a1c460b8ef7d0b4e9b,0,0,1,0,0,0,0,0,0,0,0,0,0,0,"hi"
np,03aa43bea4f93697664a69fef3117299,0,0,1,0,2,2,0,0,0,0,0,1,0,0,"THX"
np,40e36837f390fe32a7df3b99d02fc63f,0,0,1,0,0,0,0,0,0,0,0,0,0,0,"hei male"
p,a03edc2f70bbebc73ef3ba3f06968360,0,0,1,0,0,0,0,0,0,0,0,0,0,0,"U there"
np,500b8afdc35b66099d38010dc4e0efb7,0,0,1,0,0,0,0,0,0,0,0,3,0,0,"anyone ever use objectdatasource with a selectmethod that has optional praams"
p,d79fcf39ef0828bb234b60b90a1fd725,0,0,24,1,4,0,0,0,0,0,1,3,-5,20,"Lynda Im so sorry I woke up late and then I went to eat something ok heres the I leave by can only stay like hours next weekend I could stay hours loli I just want to make the most of the few times I come to see you per month okay but do realise that in h weekends he may work and I could stay longer than too but if I come today I may not be able to in h weekends well maybe I still can loli and why is that loli dont call the cops loli me too but you are fine with h hours alright let me see what I can do call me in h hours crap I wont even have time to shower ew bunch of cologne loli ok call me in h hours and what about your dad what if I am in your house and he comes ok call me in h hours ok"
p,39bd8b11509b5ddc5948b5b77f034ea1,0,1,18,0,1,0,0,0,0,2,3,4,-8,7,"hey been thinking about you ur not still untrouble ru well be cool so i cant make it over there you dont wanna get grounded i dont wanna wait till the last minute what your address ok and make sure you have ur phone on sat cause im gonna call before i come just to make sure yeah i know its no problem for me i dont mind yeah if i leave right from work can i shower at ur place i didnt wanna scare you off thats why i said h im gonna mapquest it you gonna have your phone well i get off at h and im gonna get gas and cash my check so make it h sharp did you save my i hope your mom really is gonna leave hey is she able to check your messenger list no i mean on here you should always enter ur id and password in instead of auto login well i guess were all set then"
p,e788b3a47e4d812ed26036a93272c134,0,0,1,0,4,0,0,0,1,0,0,2,-2,0,"just missed u not to long talk to u baby"
np,14af4ca97e316b17ea96286dc6882fd4,2,0,25,0,7,2,0,0,0,0,0,4,-3,12,"what is the smallest SVC spec 227a9a17d1db3f8e5c71a150345fb2a6 seriously the smallest I should meant number of features rather than spec length a long spec detailing a small number features would be best I want to use SVC for a purpose that have many requirements just simple drawings hmm it has animation guess I have to make SVC Rillton interactivity is not required either oh good hmm still has slink I need links well I only want to allow data URLs for those do I have to use slink to get that Lordy well it is not hard to implement I agree just verbose but now I have to use namespaces or more than one anyway always a sign of trouble well not religious in this case I need this to be extensible so namespaces helping much 227a9a17d1db3f8e5c71a150345fb2a6 so are the features discussed in this appendix the same things I would find in SVC Tiny or is there a table that explains this concisely somewhere"
np,389d940242efd923293a222c0013f176,0,0,4,0,0,0,0,0,0,0,0,1,0,2,"do you even have a configured local area subnet the windows workstations are saying their IP is your public IP for whatever reason and therefore their NETBLT name resolves to that"
np,52a448fc3ea9d3db2342817018f6b1bb,0,0,3,0,0,0,0,0,1,0,0,2,0,0,"supp brisk bromo"
np,bc7696cb109e489b7285592e5f4e767b,0,0,1,0,1,2,0,0,0,0,0,0,0,0,""
p,c1f43e1c992120a1c460b8ef7d0b4e9b,0,0,1,0,0,0,0,0,0,0,0,0,0,0,"hi"
p,39bd8b11509b5ddc5948b5b77f034ea1,1,1,18,1,0,0,0,0,0,1,1,2,-12,11,"whats up call me you cant when its on a charger ok wow what oh yeah i wish i had more time to work out though yeah ill put my cam on hold on Ty im just web surfing hey how long have u been using messenger well u kn how when you go to search for a room and you have the join room tab on the pop up isnt there supposed to be another one for like personal rooms yeah thats what i thought that sucks cause they were the shit now they do i wonder why they did AOL is okay but the profiles suck and alto of people dont fill em out"
np,dea40589fd02417a519106394ba86a4c,0,0,2,0,1,0,0,0,0,0,0,0,0,0,"heii m or f"
np,7780ad7003f15ffc3b31177513eac4f9,0,0,1,0,0,0,0,0,0,0,0,0,0,0,"include the correct headers i guess"
np,539b64af74fbd332c9af7269e3fea2f8,1,0,6,0,4,0,1,1,0,0,0,4,0,0,"Lal looking for someone to run me thru eye of the north CSN ATP Duel Cup with cash prizes on Saturday th register ams syr fixion the script now"
np,7edd356b467cb5d8a61ad700977a2967,0,0,2,0,0,0,0,0,0,0,0,0,0,0,"hey male h you"
np,06cb330920ae58e1614c9145d983b3d6,0,0,2,0,0,0,0,0,0,0,0,0,-4,0,"whatever the almost as if they ignored web storage while it was out in production for years waiting until going to LC to even bother looking at it"
np,b844a0a98f81c321afe1d38ae37f3c28,0,0,1,0,1,0,0,0,0,0,0,0,0,0,"channel"
np,65155a370c653f5fb9cb70ceff32710c,0,1,8,0,3,2,0,0,1,1,1,2,-1,6,"new h is the old one nv not on the h I am using punching on the notebook that usually happens with me too i think i must have been lucky enough to have reconnected quickly enough that I both got the same address and nothing timed out i would not have been happy to have to start that solarise h build again yea i should but not going to stop it and restart it now"
np,77f8f6766e5efd5e7b72e02babe992f8,0,0,1,0,0,0,0,0,0,0,0,0,0,0,"hey gurl or guy"
np,7c8b874eae54b22267117db8b277a27c,0,0,4,0,2,0,0,0,0,0,0,1,0,0,"hi china h f ANG u and u"
np,ccf30d819688c4589cd857dc89c74695,1,0,5,0,2,3,0,0,0,0,0,3,0,0,"sault ICI english chat room ok"
np,9632a7d8034593d3ef3a3635bc09f5db,0,0,1,0,0,0,0,0,0,0,0,0,0,0,"hey asl"
np,1a367795404140f145824cc116bb6b7e,0,0,6,0,3,0,0,0,0,0,0,2,-2,7,"Vista is on DVD looks like there a bug in this room h's seems like it looking for something when u open if got an inactive mapped drive disable it might be a good idea to fix the problem instead of getting around it you mean remove it from start menu"
p,39bd8b11509b5ddc5948b5b77f034ea1,1,1,18,0,1,0,0,0,0,0,2,7,-10,14,"i had a shitty day at work today i got a h day review today and my boss says people were complying about me but they like to be really picky at my job dumb stuff whatever they can find im getting tired of it all bout to start looking elsewhere i wanna be a personal trainer anyway yeah they dont deserve me working there thats i got big shoulders and a big cack what time does she leave on sat oh tomorrow yeah you definatetly gotta call me tomorrow but only after she leaves too so by the time i get off work shell be gone or no she levin at night ok lets do that and keep everything the same time yeah definitely and call me at h just so i know everything is good its gonna be fun i gotta shower and stuff bye"
p,d18fb2dc834414a71aace67bee91c432,0,0,1,0,2,0,0,2,0,0,0,0,-2,4,"loli i did answer you said yes i do miss you dork"
np,b65d66c271744e2de68c83c35283044d,0,0,2,0,0,0,0,0,0,0,0,0,0,0,"hi asl"
np,9b8f5cbca9d15f09dab2d937363dc7af,0,0,9,1,1,0,0,0,6,0,2,7,0,0,"haaaaaaaahahahhhhh stressssssssss carzey's what HH noup goo goo gjoob oh hellllll"
p,2a77f862a19d8d47d21692543e90dee8,0,0,1,0,0,0,0,0,0,0,0,0,-7,1,"hi hun im sorry i missed your calls i was in meetings all day i did get your messages though PLS dont be upset im off work now so if you get this anytime and you call ill answer i promise"
np,0a39f78bcb297ab0ebe8a29c28bfed89,0,0,1,0,2,0,0,0,0,0,0,0,0,0,"Release"
p,0599cd3f7fc15849844468b0702ff593,0,6,31,0,2,0,0,0,1,5,6,1,-29,25,"I am watching the Pistons good no what ok no tell me Would you let me suck your dick ok would you suck mine ok I would like you to suck mine i like you thank you what do you want to do to me sexually ok You get my dick hard and I would like you use your imagination Think about the things that will get your dick hard mamamu then let me suck it ok I wont play with you real I would even swallow your cum really I do like you u are wonderful you are the only male to get me hard I would love to take a lock at your dick I like it I would enjoy yours"
p,0b6b05c740a1bf50ca7f9a461598a3b9,0,0,2,1,0,0,0,0,0,0,1,0,0,0,"hello yep yep yep"
np,8a9822ff0595044d78204c7678d53294,1,0,2,0,8,0,0,0,0,0,0,2,0,1,"hi all got a bit of a licensing question In my program making a Pugin for other programs which OS so for my code just adding a linking exception but does this mean I use Qt for that section of the code not certain because my work derived from Qt is pled but the program which is linking against my work"
np,f5af272b5b04154c260eec46f4deb905,0,0,2,0,1,0,0,0,0,0,0,0,0,0,"that is my rough impression as well my understanding of the informal history WRT Chandra is that adopting RDF as the model for all their internal data store etc set many things back many years"
p,a03edc2f70bbebc73ef3ba3f06968360,0,0,1,0,1,0,0,0,0,0,0,0,0,5,"well i hope you have happy th"
p,fac3a2081264f1dbb943eaf7165d8fc3,1,0,1,0,0,0,0,0,0,0,0,0,-2,10,"sorry about that big lighting strike knocked out the power just now got me internet back up well hope you have a wondering day hope to talk to you latter on this evening hope you had some sweet dreams"
np,0a05f6a775888e39a9d43982c021b493,0,1,28,0,4,0,0,0,0,1,1,1,-4,17,"hey nah i would like one tho the heaps cute dogs haha no i get my own loli how old yea ur not horny r u what ok thought so nah im just asking h m australia u ur location oh k why talk to me then haha im sorry ill reply faster ok what u want to talk bout why haha"
np,b844a0a98f81c321afe1d38ae37f3c28,0,0,1,0,1,0,0,0,0,0,0,0,0,0,"channel"
p,d090448efc59f5f5b3b5c2875d070a3a,0,0,10,0,7,1,0,0,0,0,0,0,-1,5,"r u there Ok Good It is nice no ok fine carry on bye confirm me tomorrow gn Bye"
p,c62283536cf6261e5ffbcb323c8a2571,0,0,8,0,3,0,0,0,0,0,0,0,-3,0,"crashed keep crashing stay on keeps crashing real bad be on at h i have h times be on at h got to reinstall software again bye"
np,104bc19e5513cba4eba2d18c7a704a01,0,0,1,0,0,0,0,0,0,0,0,0,-3,1,"If pretty useless why waste the code"
p,a03edc2f70bbebc73ef3ba3f06968360,0,0,14,0,3,1,0,0,0,0,0,4,-2,5,"Anything else u wanna know about me I work alto and save Auto tech Yeah i own h cars Yeah want me to teach u how to drive A dodge neon rt toyota Melica and Mazda Rx h Red white and blk There all sticks Yeah Kalil but easier to learn Yeah ull like it But well keep it a secret ok Ok not even me Lola ok Ok miss me"
np,c0e6ff20e46c4c3349c4437b40998a7c,0,0,1,0,4,0,0,0,0,0,2,0,0,0,"female and see nudes email me"
np,e29c9900b9e28931706cd0ab17dbe0b6,1,0,9,1,12,2,0,0,1,0,0,4,0,5,"calling java code from code how RMI and RPC are compatible in any way hm sure yes prefer some tight objects instead of services application server for NET and java sounds great u ever got in touch with this stuff mmmm guess this acceptable for me but thanks anyway"
np,1d847a10ddcfa10183b0b1c807fd2616,0,0,2,0,1,2,0,0,0,0,0,0,0,0,"Asl Yes baby"
np,a480104b0e570389c6f4284a88c7cd9d,0,0,3,0,5,0,0,0,0,0,1,1,0,0,"the bug number POST responses are NOT catchable ah there is an knell's in there"
p,47243a4a2c68f2f00899670d455a21fa,0,0,20,0,5,0,0,0,1,0,0,4,0,6,"www babe sorry Vegas Nevada hours away n vegas loli n another state not n california I do But how can I went n another state Dis morning Lied bout wut I kn u were n tha bay I drive h tha bay I have h set up smithing I have h plan a trip out there Cuz I need a hotel money all that Yao I need money h a hotel loli Naw My money is h savin right now"
np,a721830ce39d7773c3b99aa365ae3af6,0,0,2,0,0,0,0,0,0,0,0,0,-1,3,"i love you no"
np,a327478fb20b348db1a724b2c4ec55ec,0,0,4,0,2,0,0,0,0,0,1,2,0,0,"i have a window that pops up a new window but i need for the Popp to change a value in the parent window how would i do that i know how to change a value but not in the parent window but what would i use for win"
np,58a76d3fa696bbea38da399af2ece971,0,0,2,0,0,0,0,0,0,0,0,0,0,0,"hey m"
p,2d08262caa29b1bebeb24e9ad0c60ece,0,0,3,0,5,0,0,0,1,0,1,1,0,1,"Robin call me anytime today ok It matter what time ok Today is sunday aug st I Love You Kissessssss Dan"
np,ab4ec7940268ea596a79b40e350b1e3c,0,0,3,0,0,0,0,0,0,0,0,0,0,0,"hi hi asl"
np,050421e96671fe1a3d8cf2b5dbe99cb7,0,0,1,0,2,2,0,0,0,0,0,1,0,1,"trying to keep my fingers warm while really running anywhere"
np,886d20cff3a367239edf2ee6de8593c7,0,0,3,0,3,0,0,0,0,0,0,2,0,0,"evening again does my unix gidnumber have to match my sambaPrimaryGroupSID my Ldp account enumerate under unix system does that count"
np,19fc5a4e39424dedb671dc9e50cb7b76,0,0,1,0,0,0,0,0,0,0,0,0,-2,0,"whats your deepest darkest secret"
np,86e9f5ff6702160c0cc0484a335dd4bb,0,0,1,0,0,0,0,0,0,0,0,0,0,0,"do you have the time to listen to me whine about nothing and everything all at once"
np,9a8a5230faca613aa3846ad22dd581b6,0,0,1,0,1,0,0,0,0,0,0,0,0,0,""
p,fac3a2081264f1dbb943eaf7165d8fc3,0,0,24,0,5,0,1,0,1,0,0,3,-3,20,"play cards again and u makes h of us no need for u to be what a hair doo that a good thing my my my now your new photo good thing may i have that one please u can say no if u like thank u where was that taken at and the winner is sarah hushion as americas next top model was there a big smile on that one barb got to go put some laundry in the wash some one got quit all of a sudden yea no just stared"
np,15c6a89da5c72f5d1212dcee74cc9898,0,0,2,0,0,0,0,0,0,0,0,0,0,0,"hi wat"
np,299af614afabcb308f4d578bfc62d7f5,0,0,8,2,3,2,0,0,0,0,3,1,0,0,"hello hello I say hello So what Haha thanks Watching SUG stargaze Universe"
np,f15701ba748c4d6ebb804885687d684f,0,1,14,0,8,0,0,0,0,0,2,3,-8,10,"Who the what now Who Sweet Jesus I am so impressed I think I nearly had a nerdgasm. I haven multipass Oh yes you really do know your kick ass movies Why thank you Southern Belle I quite like you too Your taste in movies is impeccable As long as you don You may on one condition You have to tell me yours even if mine fails to live up to your high expectations of what an Englishman's name should be My name is Ben not very British I Wow weird stuff What are the chances of that happening I mean it My spelling is borderline waeful most days I wouldn Let How"
np,ed647310fb86d4d534a097fa3c5773e8,0,0,3,0,0,0,0,0,0,0,0,0,0,0,"hey h m u"
np,042dd99eb0ff8653814e445ca0093427,0,0,5,0,6,2,0,0,0,0,0,1,0,1,"yes IE treats as IRC not sure about any other stacking order bugs I hardly ever use IE I work on Fairfax I have clients"
np,85f7cc4deb6f328fb5177ec5284112c3,1,3,48,2,11,2,1,3,1,5,5,4,0,18,"will you please do sex with me in bed i m virgin hi where what country turkey male or female i n nale too gay or bi or straight i m male too i i m also straight i need a girl man what to do ok i m h and i havent even kissed a girl before sex is so far what can i do to impress her and get her to do sex with me please help man please yes u can wait for second here look that photo its me yesses thanks sure have u seen my photo yes you are right thats my photo open it yes its me i have yahoo only tell her to add me if you are on MSN you can still add yahoo thanks i will wait for her till tomorrow ok let me log in hold on ok i m there add again i didnt get request yes"
np,d81d2d7024efa8800ec69e5b97432bca,1,0,5,0,9,0,0,0,0,0,1,1,0,5,"guys if I do a select and limit the result to h display in a but also offer Previous and Next buttons on my page how can I navigate to the next entry in the database ordering the results by LastName and not the ID so I would want to grab either the previous or next alphabetical record Thanks in advance guess what I mean to ask is there a way to have mysel return the two records immediately next to my single result if I am limiting the select statement to one result though how could I do this but there is a way to have mysel do that thanks for the help anyways man"
np,34becb49b055204c613766efd2fc6bde,0,0,3,0,0,0,0,0,0,0,0,1,0,0,"hi im adar edgar an how old r u"
np,cab226fcb652738794354e7c5254cc8c,0,0,11,0,1,0,0,0,0,0,0,1,-2,0,"y what happened ooh sad what was his name well i dont have much synanthy to give to anybody i am going through a tough time anyways asl what from"
np,b25b6b77a0087ff8385941e5545d32ea,1,0,5,0,9,1,2,1,0,0,0,1,-4,1,"Generally you stop events firing but there is no real need to do anything with the ones you want Well you can preventDefault of course not sure what you are trying to do but I think you can do what you are requesting Fun Read and work out how many of the listed specs are at WC Then subtract the ones that were imported wholesale into the WC without changes almost without"
np,c62f6586a00a65b7471b1dc1316719a1,0,0,23,1,0,0,0,0,0,1,1,1,-6,4,"hi f h russia you no we can chat here cant we hey I had a question I want to go Aus for college mail me at but I have heard you guys kill asians indian in particular I am kinda scared right I am Monica you ok nice name will do what if I tell you I am a guy"
p,d18fb2dc834414a71aace67bee91c432,0,0,23,0,10,5,2,2,3,0,0,5,-10,30,"YAY chelas is back loli www your even on loli missed talking to u no more getting grounded please loli good skip school loli u can miss behave in other ways though loli me too loli no i hated when u were because we talk your still a cutie awiwi can i join u in bed ha yes i am night Nice hearing from ya though www loli stop blushing loli nite dork"
np,8b3687499080633e1898fa1dd209ef81,0,0,1,0,1,0,0,1,0,0,0,0,0,0,"7c581dc3aab58e9918cc3b430da5ded6 try fiddling with"
np,d07f36b486d142fe7e2e1735bacb1f2c,0,0,2,0,0,0,0,0,0,0,0,2,0,0,"deus Hehe"
np,1712a086d698f2ebc6f00c7eb181724d,0,0,2,1,2,2,0,0,0,0,1,0,0,0,"hello ew"
p,89319407d854bb82113349ecf7ce3682,0,0,47,0,4,0,0,0,1,0,3,3,-8,11,"ur back sexy nope stroking my dick jak i just got back who no cam try k i wasnt silly u want me to do it later h you dont u r u there i got booted i asked u a question did u get it i didnt see the answer really can u be in ur nighty tonight or tee n undies u dont wanna or u wanna be undressed all together loli u tell me i know it gets u hot mom gonna be home k gotta be carefull what time h u allowed up til if ur busy chatting i will let u go k whats she doing oh u can see her when she comes in ur room k baby i miss ya mmmm wish ya were here ok go i will be around maybe intis love ya"
