predator,senderID,letterLines,wordLines,numberOfLines,spaces,funkyWords,posEmoticons,neuEmoticons,negEmoticons,consecutiveLetters,alert,blacklist,misspelledWords,negativeSent,positiveSent,message
np,f139aba52f9fa1394b4034a7954b2220,0,0,1,0,1,0,1,0,0,0,0,1,-2,0,"a924fb58d2c25874322f4e5126f608b9 it just seems that some people are incapable of understanding when appropriate for specific meditate to be hidden and when more optimal for the meditate to be based on visible content"
p,22b43adc75cd94c074892cee0b964eb8,0,0,5,0,15,2,0,0,1,0,1,1,-1,4,"u online got disconnected earlier Hey I am going on Saturday I made up up mind Just let me know if you are for sure and all be online in the morning not sure about the night I may pop in to see if you reply gonna be soosoo great baby hey probably leave at h from here so I should be there close to h If you want call me around or so get some condoms"
np,99e63ee73602f06419eea4668f40c1c4,0,0,22,0,15,2,0,0,1,0,0,2,-3,10,"hizz how are u h male calf cool r u hot loli loli ok MMM Wana share photos mm u so mad woman calm down"
p,503343ecf680e0899a3863cc8bf2b9dc,0,2,14,0,2,0,0,0,1,2,2,2,-2,11,"hey miss me uh Hu u been horny lately cause i wanna know loli have u loli mumm if u were here u would be i do and id get u off i know u want to cum for me u want my hands touching u dont u ok i wont touch ok loli"
p,c62283536cf6261e5ffbcb323c8a2571,2,0,14,0,3,0,0,0,0,0,0,0,-1,5,"hi good and you be on the web much longer not worth what i pay for it crashes all the time sure and u have to get a phone number so we can talk be on the web monday already got it set up have a regular phone only a cell phone name the date and place ok"
np,aebff1898300a23a6039757fbe40fa03,0,0,2,0,1,0,0,0,0,0,0,0,0,0,"hi hw r u"
np,45938e7050dbd5fe62f0d90a37a61d3a,0,0,2,0,0,0,0,0,0,0,0,0,0,0,"hey asl"
np,4be2f6603ac950277c576ff07cc4e27d,0,0,2,0,0,0,0,0,0,0,0,3,0,1,"whats thebes tool for saving html as PDF i need a bhp solution"
np,fae3fcc731dff954a09e10cf20dbd875,0,0,12,0,1,1,0,0,1,0,0,2,-3,10,"loli hey u IDC loli loli no im sitting in my dungeon studying algebra no no i think i got it im studying h test shh yes k"
np,8f6c782c010b09f3efdf9af8afce9a05,0,0,2,0,1,0,0,0,0,0,0,0,0,0,"hi"
np,cea8177c15594b7594b626bb41664120,0,0,2,0,3,0,0,0,0,0,0,1,0,4,"Please bash other channels possible to be funny without bashing others"
p,1290ea419856093edf96b1263cb1ca1e,1,0,32,0,3,1,0,0,0,0,0,2,-2,3,"hi how r u Aimee yes so u came early tonight what is happening honey oh ok it was expected by st and nd so h days early yah just h days so how is ur mom many girls message me so I have to chat for a while and say bye no just chat friends most of them one time friends no ur age girls I found h or h nothing just one more old friend Messaged me she is mother of h kids and now she is pregnant for the rd one oh ok so u will come back soon ok I will wait for u ok so where is ur mom tonight ok I could not get u so when ur expecting ur mom u said I not like cramps"
np,b844a0a98f81c321afe1d38ae37f3c28,0,0,1,0,1,0,0,0,0,0,0,0,0,0,"channel"
np,843f95377fc272f8277a486f5ec69c96,0,0,2,0,0,0,0,0,0,0,0,0,0,0,"Sup How many sugars"
np,1287712a25c15921c059073b2236732d,0,0,2,0,1,0,1,0,0,0,0,1,0,0,"male looking for female naughty hi"
np,42f63dea69401bfd7518280439e6cc52,0,0,2,0,0,0,0,0,0,0,0,0,0,0,"hi asl"
p,d18fb2dc834414a71aace67bee91c432,0,0,2,0,8,0,0,2,0,0,1,0,0,2,"hey there I should be home at like around h tonight goto bed without talking to me loli I have school tonight Or if you have AIM u can message me there always on it during class My screen name is jkspeedster1982."
np,a02b1a6a719a6087667e21c6cfcf161a,0,0,9,0,1,0,0,0,0,0,0,0,-1,1,"hi f im from sweden you think so little you sure if you want to send maybe not no"
np,36194710f3d5ea9c5c1391184d82ac2c,0,0,1,0,1,0,0,0,0,0,0,0,0,0,"hi how r u"
p,f538a2a92145534b4b61893399479fcf,0,0,2,0,0,0,0,0,0,0,0,0,-2,4,"why did u get into trouble h funny"
p,053364a8ce3df76dadd5fe75fb056f72,0,0,1,0,0,0,0,0,0,0,0,1,0,0,"hey i had to come back and get my other car mt honda SUV now where are you"
np,cbdef2edde4bfa3f254158e642080372,0,0,2,0,0,0,0,0,0,0,0,0,0,0,"hi asl"
np,2a78e4ddb897d821d45a3ba9ce2078d5,0,0,2,0,7,0,0,0,0,0,0,1,0,0,"Cool option I heard of it Great link for that thanks"
np,41325a818881f2c6dd624521e50df013,0,0,2,0,0,0,0,0,0,0,0,0,0,0,"token ring ah"
p,c62283536cf6261e5ffbcb323c8a2571,0,0,21,0,4,0,0,0,0,0,0,2,-2,7,"hi how are u great Ty yes by the golf course empire ranch rd east of carson going toward dayton yes no where in dayton do you live o ok do you have a are u just wondering you like older h no do you o ok send you have the older version of yahoo know to send i can put one on my profile"
p,0599cd3f7fc15849844468b0702ff593,0,0,2,0,0,0,0,0,0,0,0,0,0,5,"wow another day free"
np,717b070f3aedc2d54c44a3343a6009a4,0,0,2,0,0,0,0,0,0,0,0,0,0,0,"hey asl"
np,08e3f01f739f73c3d0a59dc5764e552b,0,2,15,0,9,2,0,1,0,1,2,1,-2,11,"are you horny h f usa asl are you hot can i have some of you xx i dont have any but ill get some if you show me some xx do you want a picture or not all you have to do is send me a pic i decide whether your hot enough to have one of me and then if yes then you'll get a picture x are you putting the link on xx yay xx do you need my email ok x got one yet sexy haha all good"
p,fac3a2081264f1dbb943eaf7165d8fc3,0,1,1,0,0,0,0,0,0,0,1,1,0,3,"hey sexy have a wonderful day"
np,f8a740a033acd9c04a8128317c4dc8e2,0,0,1,0,1,0,0,0,0,0,0,0,0,2,"Linux WPA what kind of ports are there for wink"
np,6b96beeb5f099a3a9910d6833ba162aa,0,0,17,0,7,4,0,0,0,0,0,2,0,12,"hi boy or girl haha me too what age h whats up where r you from Indonesia Eucha u nice are you a moslem yea alhamdulillah what time is it there have you good nice to know ya"
np,42192e9b6adc8a45c267e6bfffeb4706,0,0,2,0,4,2,0,0,0,0,0,1,0,0,"i have a lot of ram can i use a higher octroi resolution to achieve a faster render hi"
np,54d718f6cca21e66ee5a5e3bfd001912,0,0,2,0,5,0,0,0,0,0,0,0,-2,0,"is puzzled how bug h differs from than including a unique identifier and being rather than if the discussion in related bug h is"
np,55255c44b29774211ed1219b5a0b8ca3,0,0,2,0,2,2,0,0,0,0,0,0,0,0,"how are u"
np,f7c3ed3c8011e78e15b62c46239b9ed1,0,0,1,0,1,0,0,0,0,0,0,1,0,1,"The order in which I specify the Uri mappings in matters right"
np,87173045e04bb51a925bcd4a4451694e,0,0,1,0,0,0,0,0,0,0,0,0,0,0,"idolism"
p,aebe7a87ad50fbad92d9931c49cae848,0,0,44,0,4,0,0,0,4,0,0,7,-1,9,"Yep Lotta cheese Just cheese Cool dingy ahh dingy like loopy LAL Naarah Just a girl yep I stay busy Camping in the wilderness a lot She must work a lot Long hours Damn Have other kids at home Darn LAL yep Nah wait till older ahh Yeah s the smell of diapers is rough noo Be careful lot of girls end up as mothers that mean to Be careful Good Be smart Good Uh huh see Yep girls mature faster than boys Yep got their priorities right LAL PRB I used to be no longer h years Happy now Yep still here Cool enough to eat now huh dominos Cool"
np,042e03f5f134675603377b40efd0eef0,0,0,1,1,0,0,0,0,1,0,1,1,0,0,"hello"
np,d7556c651fbd5e98cfee7dabe5915ec2,0,0,2,0,1,0,0,0,0,0,0,0,0,0,"hi m or f"
np,a9b326df4e6da61c5b6f5e1058be83a2,0,0,6,0,12,0,0,0,0,0,2,2,-3,7,"b8810fee2f4a71f849f3f7409546d1d9 no seen it yet is looking now b8810fee2f4a71f849f3f7409546d1d9 I agree about the tab issue count as one as far as in the message I think there are likely many users in console environments who have as far as how to distinguish classes of messages I think The other questions I have any brilliant insights one on b8810fee2f4a71f849f3f7409546d1d9 I think the expectation is that users need to do a certain about of Emacs customisation for each time of they want to be able to have Emacs parse error messages for"
np,4124bc0a9335c27f086f24ba207a4912,0,0,10,0,4,0,0,1,0,0,2,2,-1,14,"yes interested I was planning on being out thursday the gears team was planning on taking a lazy approach to the spec because well we are super busy but we are interested we were just going to forego having actual meetings in favour of email next week would be better for me i have some comments i need to send to and i think michael Nordman is going to send some too send wrapped up as in a recommendation that is a little faster pace than we were anticipating i guess you can go ahead and do that but not sure how much useful feedback we can give that quickly"
np,6b57ea7f33069df5914663ba9e59afdf,0,0,2,0,3,0,0,0,0,0,1,1,0,1,"does that matter yeah make sense to optimise the usually cases"
np,70d9469fbd403f05b7f5e27d173e6f69,0,0,1,0,0,0,0,0,0,0,1,0,0,0,"caber sex I"
np,514929bb1620777fab309ce6e08e3f74,0,1,21,0,2,0,1,1,1,2,3,6,-4,6,"hey h f usa eh a bit yeh i like dick i but i lick pussy u got uptube yeh could u subscribe h my bro it ok if u dant Wana just he need h subscribers for his teachingly class h get a A thanks il tell him h mention u in his next video wats ur name Ashley i ctg wats ur facebook name thanks chapman add me ctg"
np,b8810fee2f4a71f849f3f7409546d1d9,1,0,2,0,9,0,0,0,0,0,1,4,-3,0,"actually I get to put stuff in the spec If I did and would be valid by now has warnings especially around the area of authors shooting themselves in the foot by not using"
np,ab7faae5d7b250ea8606486575f8f79c,0,0,1,0,1,0,0,1,0,0,0,1,0,0,"Use the svgs DECtape"
np,554887e9b949bdcf680693daf578095a,0,0,1,0,1,0,0,0,0,0,0,0,0,0,"giving a second try now and see happen"
np,f4ea67a9a14383739cf10e3e0dc17dcd,0,0,14,0,1,0,0,0,2,0,0,3,-2,22,"hi yup oui cool oh same loli yup loli haha www thats annoying loli what a freak www wow oh thats a good show i like medium"
np,c08fc91604c4ccc8fb4104bd252873f1,0,0,2,0,6,2,0,0,0,0,0,1,0,0,"np Enjoy faster Windows builds I know the schizont"
np,6f58f1c6e1c23b9883b863c676e249b7,0,1,1,1,1,0,0,0,0,0,1,0,-4,0,"shit happens"
np,a63f9a931fe364c1c8cb6b126d9fd76b,0,0,2,0,0,0,0,0,0,0,0,0,0,0,"hi hi"
np,25812bf456959aa5f28dc570f341a3ba,0,0,1,0,3,0,1,1,0,0,0,2,0,0,"is CSS Working Group Discussion Logged to"
np,fd32acd333d33aac1ae504785b15390c,0,0,10,0,11,2,0,0,0,0,0,3,-3,6,"Kelsi all image I bet boring I love the De Nero parts loli Hmm I thought the make playlist burn is the most intuitive way to go actually do you know who the guy with the red hair is supposed to be the snakes on plane OK"
np,ffc40d2d8fab179eca5a7482db6eb483,0,0,3,1,0,0,0,0,0,0,1,2,0,0,"hee Ameagle h ere"
np,7c161dd7f034e5dfb909413f72cf4a9d,0,0,2,0,0,0,0,0,0,0,0,0,0,0,"hey asl"
np,7a205621b91e4878465075e964d2b1e8,0,0,1,1,0,0,0,0,0,0,1,0,0,0,"hello"
np,354401c98b40acf15f5081ef10b77b69,0,0,28,0,0,0,0,0,0,0,0,6,0,3,"hi where you from nonunion ok good nonunion Ananna anana ana nana nana na nana na na ana na nana na an ana Nanon a aananana na na na na na"
np,fe04206602d7f9e700d4022f39fe2e5a,0,0,1,0,0,0,0,0,0,0,0,0,0,0,"namaskar"
np,69b0d3dfe919a6b860a9fac82de52a7e,0,0,3,0,1,0,0,0,0,0,0,0,0,3,"yeah but probably change that and instead make it optional for As to honour it"
p,926981922f4a48d98ebc92a9375e5d45,0,0,3,0,0,0,0,0,0,0,0,0,0,2,"hey u r u here hope u getting online soon im getting sleepy"
np,5418229d72ff723cedba191fc7da5ece,0,0,3,0,1,2,0,0,0,0,0,0,0,0,"hey asl"
np,4aa3246b7522b462fc45c58ca09632e0,0,0,3,0,1,0,0,0,0,0,0,0,0,0,"hey h f netherlands u"
p,c62283536cf6261e5ffbcb323c8a2571,0,0,3,0,2,1,0,0,0,0,0,1,-2,2,"where are you hope wrong be back at h"
np,276cc26a9f22f42adf2bdde0a8b09894,0,0,25,4,6,0,0,0,0,0,6,1,-6,14,"hi m or f m age are you there h horny nice alone in room naked really I am coming do you want virgin hair in your pussy like without hair it is nice to put lips I want to love you kiss you fuck you which position do you like doggy how is your pussy"
np,a3635a8379239c7bed19a85d06e8eb8e,0,0,2,0,1,0,0,0,0,0,0,0,0,0,"Hello"
np,4c681049601b3c374f1d2c0077c99049,1,0,1,0,0,0,0,0,0,0,0,0,-2,0,"Thus making them impossible to style and they instantly collapse spewing their contents into the DOM"
np,f7288ceddcf103edefd2d9d097dbeb9d,0,0,2,0,0,0,0,0,0,0,0,0,0,0,"what sure if i had one"
np,30c0d27817adccec1490576e90e88bb8,0,0,3,0,1,0,0,0,1,0,0,0,0,0,"YAY ooh WHAT DOES THIS BUTTON DO"
np,b25b6b77a0087ff8385941e5545d32ea,0,0,4,0,3,2,0,0,0,0,0,2,0,3,"I was going to ask you the same thing I yet As been a bit busy I was happy to see all your checking today though"
np,cdb7c416c0bce9b3c3ce577741964153,0,0,7,0,3,2,0,0,0,0,0,1,0,0,"hi f u what i age"
np,635fef0c0ce3dd3b9a8895544a8cecad,0,0,2,0,14,0,0,3,0,0,1,1,0,0,"Hi all recently switched to using samba as pdq using logon path but user shows up in and why does the windows side get to see the unix username instead of the normal username firstname used roaming profiles for ages and they used the full firstname surname instead of the firstname in Docs and Settings"
np,a7424a9664cceb903b4234beceaa8c6c,0,0,1,0,1,0,0,0,0,0,0,1,0,0,""
np,0fcd72b7cbe1dea64f592d3bf59c9231,0,0,3,0,0,0,0,0,0,0,0,0,0,0,"hi h m here gay"
p,d18fb2dc834414a71aace67bee91c432,1,1,1,0,3,0,0,0,0,0,1,1,-4,5,"than you so much for the beday wish I miss you too I had fun tonight I was safe and sober while all my friends got drunk and i had to drive them around LAL"
np,3980c5f871571a54dea7ec94eae6686e,0,0,2,0,0,0,0,0,0,0,0,0,0,3,"Afternoon gang always great to sit back and just take in the intellectual conversation"
np,d8cbd88adb014b6711566dd1df392378,0,0,2,0,1,0,0,0,0,0,0,0,0,0,"hi"
np,7df02b967e190c4cc000d93bf610415c,0,0,1,0,0,0,0,0,0,0,0,0,0,0,"hi asl"
np,41514807359268b54280bc3618cd3bcc,0,0,2,0,0,0,0,0,0,0,0,0,-1,0,"hey no what is it"
np,64e37220716c84511aeee8ba8f730b5c,0,0,2,0,0,0,0,0,0,0,0,0,0,0,"HeY you first"
np,9b41f57132444d688d026aff3ce15ac6,0,0,3,0,0,0,0,0,0,0,0,0,0,0,"hi asl m h"
p,9775a796b1ac00a2a756f530bf554582,0,1,6,0,0,0,0,0,0,1,1,1,-7,0,"hey you nothing u u there i never have problem talking h Othe ppl only u cause a delay i dunno its killing me the delay"
np,6f4f48fbabc810a760f4fa41403adbae,0,0,2,0,1,0,0,0,0,0,0,0,0,0,"hi"
np,3f2e2531201cfbf853f16f668132eaf2,0,0,1,0,1,0,0,0,0,0,0,0,0,0,""
np,b8810fee2f4a71f849f3f7409546d1d9,0,0,7,0,11,2,1,0,0,0,1,2,-1,2,"yes changing the DECtape is not enough to become confirming ATM you also need to change the meta charoset thingy conforming even argued that for compt with legacy markup generation code we should make the long form conforming 69b0d3dfe919a6b860a9fac82de52a7e has disagreed so far well the contender issue for that is the requirement to have wrapper me too yeah the obvious next question and politically it fly at least not easily"
np,5d5b78699e57104f2fa03bbdf7b9197b,0,0,1,0,1,2,1,0,0,0,0,1,0,0,"by Art on Fri Jun h"
np,8720b1bb098a8f70d156b9fc2028d7db,0,0,2,0,4,0,1,1,0,0,0,1,0,0,""
np,6bf6443c8d8d3dbd2e8798cefc00d963,0,0,1,0,3,0,1,1,0,0,1,3,-4,0,"At hiding in the speakers room trying to pretend not ridiculously nervous about my microformats session today"
p,2d08262caa29b1bebeb24e9ad0c60ece,0,0,4,0,2,0,0,0,1,0,1,1,0,0,"hi Robin are you there be on later on tonight Look for me ok kissessssssssss Dan"
np,cff95bee247abb4d0e8fec986b5fe19d,0,0,2,1,0,0,0,0,0,0,1,0,0,0,"asl hello"
p,ca2ac2fc60098c8f3346aed97ccacbec,0,0,33,0,6,2,1,0,0,0,0,3,-7,21,"hi wusp yeah i just got home yeah ran only h miles toat was tired haha no you said loli so i laughed with you yeah are you sensitive like on what i say or when i laugh no why would i do that i would rather laugh with you i can be silly too yup Friday finally yeah of course isnt it no work girl for h whole days haha i am being silly huh like a kid so what did you do today good girl reading CNN"
np,1337f8ea79310cd0867f65b556f6566c,0,0,2,0,1,0,0,0,0,0,0,0,0,0,"Hi asl cool"
p,4ab0a550ebb27f9a95e31ccbf0114850,0,0,8,0,0,0,0,0,0,1,1,0,-1,4,"hey little cutie what did you do today fun when do your rents go back to work oh i know i know i just so horny im sorry"
np,d15d9f30b67d5b8919fe621397a68ccb,0,0,4,0,1,0,0,0,0,0,0,0,0,0,"hi hmm u there"
np,25812bf456959aa5f28dc570f341a3ba,0,0,1,0,7,0,1,1,1,0,0,0,0,0,"is HTML WG weekly h May"
np,de95b3231ad0d88c0129cf1311222288,0,0,2,0,0,0,0,0,0,0,0,0,0,0,"hey h f usa"
np,f139aba52f9fa1394b4034a7954b2220,0,0,4,0,7,0,1,1,2,0,0,1,0,2,"they claim they can do it by not making any changes and requiring an But that the way to make progress oh gosh Mike says I responded to mail and"
np,fd9ef1223e855714294498ebfde79f98,0,0,2,0,4,0,0,0,0,0,0,1,0,0,"Tab Atkins is working on the flexbox draft you can ask him about it in on"
np,a6fb9c8f5612208f69ef7ad9b779f219,0,0,1,0,0,0,0,0,0,0,0,0,0,0,"hey m"
np,f1cbc7cdbca8fdddb90e7a7bfe28e224,0,0,2,0,0,0,0,0,0,0,0,0,0,0,"hi h f estonia"
np,8b7a8196348038c107614af0b08f2d21,1,0,11,0,3,2,1,0,0,0,0,1,-6,0,"we just remove SVC images so wrong for what introducing security vulnerabilities why not just use SVC in HTML used svc images before too bu t they having all these strange problems with SBLI hides not sure how use interacts with being in HTML"
np,b8810fee2f4a71f849f3f7409546d1d9,0,0,5,0,9,0,1,1,0,0,0,4,0,10,"for instance systems would benefit from a English plus sighs at optimism about parsing as XML back when Netscape decided not to sniff smallness in in mouilla was good luck with others getting it right if the folks"
np,2c736e35a26e161db845fff939cc463c,0,0,1,0,1,1,0,0,0,0,0,0,0,0,"asl"
np,8efcdbfb87dbbeee815177e6615b8446,0,0,2,1,0,0,0,0,0,0,1,0,0,0,"hello guys anybody knows how to get a resolution higher than cs with an Intel GM card"
np,571055a4bff9fb6ea675d38374df3460,0,0,2,0,2,0,0,0,0,0,0,1,-2,0,"bul why do you ask when you have problems ask this channel or"
np,20dca21bd69466ae4901030cd48963e3,0,0,2,0,0,0,0,0,0,0,0,1,0,0,"hi guys Hali there by any chance"
np,15c83ef0f2bc4bb69a4f1f7d146bffbb,0,0,3,0,1,0,0,0,0,0,1,3,0,0,"Wann fuck didnt think so"
np,fd9ef1223e855714294498ebfde79f98,0,0,4,0,5,0,1,0,0,0,0,1,0,1,"asking my wife computational yeah you got it web Greekery"
np,639ae58f7f6daac9164570abd4f8f8f8,0,0,3,0,2,0,0,0,1,0,1,2,0,0,"Arnon mysqladmin root then try your root pass"
np,4a9247bcc672d69e9193d68d02dd7d3f,0,0,9,0,14,0,0,0,0,0,0,1,-1,5,"how to have the result of a command in a vim buffer the draw of the for example return in the second split the ls result no exactly what I want because I use and if I want to use the I must be in the file so I want something like the debug window but with the result of my command OH YES THX for the THX THX"
np,3f2e2531201cfbf853f16f668132eaf2,1,0,12,0,12,0,1,0,0,0,0,3,-4,18,"If you consider shouting at someone to be Sounds like a good premise for the next in the Gta series The pain of organising complex hierarchies in cfs sounds like it could be greater than the pain of switching to a VCS since DVX seem to make it relatively to work without a centralised repository so be alright at first even if the WC actually host the files Do our limitations have to include relying on the facilities remembers seeing lots of stomal stuff on so it seem that uncommon to rely on external services That sounds reasonable to me though is it worth pushing the commits to cfs rather than just uploading them as static files into a web server directory somewhere Maybe it would be worthwhile just so people who understand git could do not more complex but different and people already understand cfs and have it installed so at least twice as much work if they have to have git too sure necessarily true The success of the work is dependent on volunteers contributing to the work and that is strongly dependent on how easy it is to contribute"
np,c1912568219047709a378e41c7606602,0,0,2,0,0,0,0,0,0,0,0,1,-3,0,"hmm no way to include JavaScript via it seems a bit odd now that"
np,33df865773abcbd1ac49ebf8349e700c,0,0,2,0,2,0,0,0,0,0,0,2,0,3,"On win I have a cd with an attorn that I want to launch a specific URL in the default web browser How can I do this thanks"
np,f676d6f993d218c809593f02705afc80,0,0,15,0,23,0,0,0,0,0,0,5,-1,7,"It has an X It deals with XML When doing webservices how would I get a Request object But free and pretty I wonder if you can use google mail space for google base Does no one else here do webservices? Or ever want to get a Request object They have big drives Seriously who would USE two gigabytes of mail using like MB deleting nothing for like a year now Course all I get is personal correspondences and the regular number of mailing lists Teh searching thing You have an app that needs to connect to a server It need to parse a website you have control over the server However it needs to get something from the server that from some reason it get there Quite possibly so Whether you should do that is another thing have GNU find by default and windows search what dieted said"
np,50f66ecbc45488ee5826941bfbc50411,0,0,2,0,2,0,0,0,0,0,0,0,0,0,"the last ok"
p,80706012f8f9f1175c8e37c306394727,0,2,34,0,4,0,0,0,1,0,3,1,-25,21,"yeah im here im not going to be able to come see you i just cant do it im sorry nothing against you at just the age thing your perfect i know it sucks of course its not that i dont know what to say i was looking forward to seeing you just cant do it i just made my mind up last night i know your pissed but i hope you can understand from my end believe me nothing would be more fun but i have to live with it i know im sorry it really sucks for me too u can to if thats what u want i hope we can still be friends huh i told you i would be here and give you my decision and i am least give me some credit i will talk to you later if u want to gonna go for a bit though im Soo sorry please believe me the risk is too much for me no just going to get something to eat im sorry im glad u did i really tried if u were h it would be all legal your making me feel like shit now im just gonna go dont know what to say im gonna go now though talk to ya later if your not too pissed"
np,2424edeb2e54aa1c89b4b6bc7bd04ffe,0,0,1,0,0,0,0,0,0,0,0,0,0,0,"hi"
p,970f6cbfa8b79242464120ec1bc7d074,0,0,29,0,5,2,0,0,0,0,0,3,-2,17,"hi u here what u up u get my message i sound like what u expected oh really very much u sound much older i liked wish u could call u know i dont mind calling u when its safe cool so u not alone i see u know what i did already got us a room in Lawton at bestwestern when u tell me i got my ways baby yes u will have rm ser so when will the date b so when will u b able to b with me yes if thats what works best h u yeah u being honest right think this is cool because i do i know well me h just know that u will b very diff h me meaning our ages u being so young i dont want u h b hurt in later life"
np,3b2ec078cdddb17970a69f43299a98d1,0,0,3,0,1,0,0,0,0,0,0,0,0,0,"sl asl"
p,afe8ba8af6d0677a79ce0284cb9cc63a,0,0,1,0,1,1,0,0,0,0,0,0,0,0,""
np,6fe36cc88463472475caa7b1a6ea06d1,0,0,3,1,2,0,0,0,1,0,1,0,0,0,"hee hello"
np,9fe1333df8f61bc4882143b5ea25b35c,0,0,5,0,1,0,1,1,1,0,0,3,0,0,"what mean oh i play blagger u can see in this is my blag where your from"
np,2a91965a6bb05861a25f3099a4a55c64,0,0,2,0,0,0,0,0,0,0,0,0,0,0,"hi asl"
np,0a39f78bcb297ab0ebe8a29c28bfed89,0,0,1,0,1,0,0,0,0,0,0,1,0,0,"Can I create rain effect in javascript?"
np,c01e287596d8d0bf8decfaee9613616a,3,0,2,0,1,0,0,0,0,0,0,4,0,0,"ftp will be fastest i believe so either would be faster than SCP and ftp vs SMB would depend a bit on your ftp implementation but as a general rule ftp would be a bit faster"
np,97f0f3ba872212b7d4e608aae24d9e8a,0,0,3,0,2,0,0,0,0,0,0,0,0,0,"hi"
p,2a77f862a19d8d47d21692543e90dee8,1,0,1,0,0,0,0,0,0,0,0,0,-4,7,"hi hun i hope your feeling better and that everything is ok ill keep checking through out the day to see if your on if i dont hear from you and i think you will really like your necklace miss you"
np,6bf6443c8d8d3dbd2e8798cefc00d963,0,0,1,0,6,0,1,1,0,0,0,6,0,0,"schoolyard Inc Saves North Carolina Members Hundreds While They Help others Coscob"
np,86836d209ebc073469aeb653c3a6db29,0,0,2,0,0,0,0,0,0,0,0,0,0,2,"would you say that your life is meaningful while listening to beethoven get laid"
p,d090448efc59f5f5b3b5c2875d070a3a,0,0,36,0,11,1,0,0,0,0,0,3,-2,19,"hi when did u come from shop ok no prob Job for u ok ur dad has car ok good Did u eat any when u go outside oh good where is ur dad now ok fine he will not come to ur room again ok good when do u sleep daily ok did ur dad tell any thing about the schedule ok is it not possible to call me now ok no prob carry on for sleep have good sleep I am in ur pillow only hug me why ok then what else when is ur school I mean at what time it starts Is it R u Korean I was in Seoul South Korea for a project It is very good place ess I went for a project on software i was there for h months"
np,ef92a9062d52395e4ab185265ba845cd,0,0,1,0,0,0,0,0,0,0,0,1,0,1,"Hey r yu gay straight Les or bi"
p,7dec33a7c4fc1d7295dea7cc5b966b5b,0,0,4,0,0,0,0,0,0,0,0,0,0,4,"wow you hung up om me well you should call me back ok ok"
np,dc64a060ea73a565ab03aef7e726ab03,0,0,6,0,11,2,0,0,0,0,0,2,0,2,"Good morning ladies p part Sorry p separate BTW i just deleted something accidently what i in Linux terminal Is there any way to recover that file Yes not that important file Just an emoticon theme file"
np,1e7f595c80ee79d6776cc844c6fe6c10,0,0,1,0,0,0,0,0,0,0,0,0,0,0,"morn"
np,d4b6b9097955642b63cbb1fa452b849c,1,0,5,0,5,0,0,0,0,0,1,5,-2,3,"What is the responsible for the colour of the border added to widgets such as which have focus tried every role in the list at The problem here being getting it set to an incorrect colour when I set the palette of a parent widget and want to set that colour back to black without messing with styles I would have assumed it was the Foreground setting as that was what I changed on the parent QGroupBox..."
np,a8c5b5df303a03eb5769a35254b056fd,0,0,3,0,0,0,0,0,0,0,0,0,0,0,"you hi boy or girl"
np,1498ba412a50a9c3c3965bf102e01d03,0,0,2,0,1,2,0,0,0,0,0,0,0,0,"hey handsome how"
np,d43145e7779ffee79022adf0238113ff,0,0,2,0,1,0,0,0,0,0,0,0,0,0,"hey"
np,a11aabeeceeae6b8cb5d12ea06b56554,0,0,1,0,2,0,0,0,0,0,0,1,0,0,"I intend to have such a list as an appendix to"
